"tm813423,Marjoun and the Flying Headscarf,MOVIE,""A teenager in Arkansas searches for identity in the headscarf and a motorcycle in the aftermath of her father's imprisonment. Set in 2006  the film explores the results of Arab and Muslim Americans being increasingly detained for """"guilt by association"""". The film links the civil rights struggle of Arab/Muslim Americans with that of African Americans through Marjoun's attendance of Central High School. It weaves her story into the lineage of the Little Rock Nine. This film is set also at Magnolia Grove Monastery in Mississippi. This Zen Buddhist monastery has been established in the tradition of the friendship of Dr. Martin Luther King  Jr. and Zen Master Thich Nhat Hanh  bringing together the themes of civil rights movements and interfaith practice. This is an expansion of the short film by the same title  that was an official selection of the Sundance Film Festival."",2019,,84,['drama'],['US'  'NL'  'CA'  'LB'],,tt10399342,6.8,37.0,2.093,"
"tm887376,Go! Go! Cory Carson: The Chrissy,MOVIE,""The Carson kids win a talent show with a dance that Cory created. But when """"The Chrissy"""" catches on  his little sister gets all of the attention."",2020,G,42,['animation'],['JP'  'US'  'FR'],,,,,2.112,6.0"
"tm859424,Maradona's Legs,MOVIE,During the 1990 World Cup  two young Palestinian boys are on a quest for “Maradona’s legs”,,,,,,,,,,,"
"ts229700,Encounters,SHOW,To please her mother  a woman sets out to find a husband  and makes an ambitious plan to find a match -- and get married -- within one year.,2019,TV-PG,22,['comedy'],[],1.0,tt11210142,,,0.776,"
"tm902363,El límite infinito,MOVIE,From early struggles to his climb up the Himalayas  Jean Maggi gets profiled in this documentary that highlights his advancement of adaptive sports.,2020,,47,['documentation'],['AR'],,,,,2.112,1.0"
"ts233732,Mighty Little Bheem: Festival of Colors,SHOW,From surprising stage performances to spraying colors with friends  join baby Bheem for all his Holi hijinks during the special spring festival.,2020,,6,['animation'  'comedy'],[],1.0,tt11738790,7.2,37.0,1.232,"
"tm824566,Ibrahim: A Fate to Define,MOVIE,In this provocative and personal documentary  director Lina Al Abed searches for traces of her disappeared father: a seemingly ordinary Palestinian family man who was actually a secret member of a militant splinter faction and vanished when she was just a child.,2019,,75,['documentation'],['PS'  'DK'  'LB'],,tt10777716,7.5,29.0,0.649,"
"tm984018,Cops and Robbers,MOVIE,Animation and activism unite in this multimedia spoken-word response to police brutality and racial injustice.,2020,PG-13,8,['animation'],['US'],,tt13322484,6.9,,4.434,7.0"
"tm1026231,Reframe THEATER EXPERIENCE with you,MOVIE,Perfume's Reframe 2019 concert  performed to great effect in the newly reconstructed LINE Cube Shibuya  is recreated as a high-tech concert film.,2020,,84,['music'],['JP'],,,,,2.084,7.0"
"tm938186,Zulu Man in Japan,MOVIE,In this documentary  South African rapper Nasty C hits the stage and streets of Tokyo  introducing himself to the city's sights  sounds and culture.,2020,,44,['documentation'],['ZA'],,,,,0.833,"
"tm824858,Cuddle Weather,MOVIE,""After realizing that prostitutes are not entitled to the best part of love making  two sex workers form a screwy relationship as """"cuddle partners"""" only to realize that they want something more."",2019,,95,['drama'],['PH'],,,,,3.602,4.6"
"tm1047951,Small Chops,MOVIE,When a business mogul hires an exotic dancer for a weekend of entertainment  it quickly morphs into a messy situation full of misunderstanding.,2020,,98,['drama'],['NG'],,tt11822492,2.9,30.0,1.159,"
"tm953122,Elf Pets: Santa's Reindeer Rescue,MOVIE,It's almost Christmas and Santa's test flights have run into trouble. Can The Elf on the Shelf  a crew of adorable Elf Pets Reindeer and Santa's gang of trusted Scout Elf friends help him find the answer before it's too late? Join Santa's cast of whimsical characters in this animated Christmas Special full of toe-tapping humor and heart  as they work together to save the holiday season and discover the power of love.,2020,,26,['animation'],[],,,,,1.29,5.0"
"ts251783,Emily's Wonder Lab,SHOW,Science-loving host Emily Calandrelli makes STEAM fun with activities  demonstrations and at-home experiments that'll make you think — and blow your mind!,2020,,13,[],['US'],1.0,,,,3.332,9.3"
"tm843222,Cultivating the Seas: History and Future of the Full-Cycle Cultured Kindai Tuna,MOVIE,An in-depth look at the full-cycle breeding program for bluefin Kindai tuna pioneered by Kinki University’s Aqua Culture Research Institute.,2019,,45,['documentation'],['JP'],,,,,0.6,6.0"
"tm1036794,Wave of Cinema: Filosofi Kopi,MOVIE,Following all the singers from Filosofi Kopi's soundtracks  this concert talked about coffee and how life changed 'cause of it.,2020,,90,['documentation'  'music'],['ID'],,,,,0.62,"
"tm810357,True: Happy Hearts Day,MOVIE,True and Bartleby try to cheer up the Rainbow Kingdom's loneliest citizen  but his gloomy mood is contagious! Can a trio of wishes turn things around?,2019,G,23,[],['CA'],,,,,0.854,7.0"
"tm1005937,Sanitation Day,MOVIE,Two cops must contend with the uncooperative tenants of an apartment complex as they try to solve a murder before the crime scene is wiped clean.,2020,,104,['thriller'],['NG'],,tt13445916,3.3,17.0,2.023,"
"tm831934,The Millions,MOVIE,Bem is the ultimate guy. With good looks  sweet mouth and with an intellect that can only be rivaled by his humour. When Bem is approached by an old friend  Wole Baba  about a job  his first thought is to walk away as he fears the heat that will come with such job. The job is simple enough,,,,,,,,,,,"
"tm899554,The Perfect Picture: Ten Years Later,MOVIE,The girls are back. And their lives haven't lost one spark of the drama they had 10 years ago. In fact  these girls are saddled with more issues in their not-so-fairy-tale relationships. It's a roller coaster ride of imperfect husbands  repentant ex-boyfriends  and daring romantic exploits. A movie about growing up and everything in between.,2019,,150,['comedy'  'romance'],['GH'],,tt12058774,6.2,48.0,1.505,"
"tm860204,Dreamy Eyes,MOVIE,Mắt Biếc (Dreamy Eyes) tells the story of the one-sided love of Ngan for Ha Lan — his childhood friend.,2019,,117,['romance'],['VN'],,,,,2.611,6.9"
"tm840242,Arsenio Hall: Smart and Classy,MOVIE,In his first stand-up special  Arsenio Hall discusses getting older  the changing times and culture  social issues and even bothersome baby toes.,2019,,63,['comedy'],['US'],,,,,2.606,5.9"
"tm976797,Fukrey Boyzzz: Space Mein Fukrapanti,MOVIE,Delhi Boys Going To Space,2020,,74,['animation'  'family'  'comedy'],[],,tt13502066,7.8,14.0,1.297,"
"tm1114639,Motu Patlu in the Game of Zones,MOVIE,A board game becomes all too real for buddies Motu and Patlu when they get transported into its world of monsters  magic and mayhem.,2020,,87,['fantasy'  'action'  'animation'  'comedy'  'thriller'],['IN'],,,,,0.943,10.0"
"tm838954,Wira,MOVIE,After a long stint in the army  an ex-lieutenant returns home and enters an underground MMA match to take on a local mobster and protect his family.,2019,,108,['drama'],['MY'],,,,,3.383,5.4"
"tm844236,True: Winter Wishes,MOVIE,An ice crystal from a frosty realm is freezing everything in the Rainbow Kingdom  its citizens too! Can True save Winter Wishfest -- and her friends?,2019,G,45,['animation'],['CA'],,,,,3.499,6.4"
"ts90696,In the Bosom of a Thorn,SHOW,After the invasion of Kuwait  a woman's infant daughter is taken from her. Now  her daughter looks to make her way back home years later.,2019,TV-14,46,['drama'],[],1.0,tt10397430,7.3,48.0,0.675,"
"ts90568,Answer for Heaven,SHOW,A righteous fallen angel must work with a rating-obsessed reporter to investigate crimes as journalists in a highly competitive newsroom.,,,,,,,,,,,"
"tm894858,The End,MOVIE,When the end is written even before everything begins  and Khaled's future is in risk for a crime he didn't do  An officer is set to bring him down.,2019,,97,['crime'  'action'],['KW'],,,,,1.4,"
"tm1073424,Motu Patlu the Superheroes – Super Villains from Mars,MOVIE,Friends Motu and Patlu must save the world from three space thieves  but the job gets much harder when a cosmic collision gives the enemies superpowers!,2019,G,79,[],[],,,,,0.966,10.0"
"tm918959,A Go! Go! Cory Carson Summer Camp,MOVIE,Cory's spending the summer at Camp Friendship with his best friend  Freddie. But jealousy flares when Freddie brings his cousin Rosie along for the ride.,2020,,20,['animation'],['US'],,,,,1.285,2.7"
"tm831125,American Factory: A Conversation with the Obamas,MOVIE,Barack and Michelle Obama talk with the directors of the documentary American Factory about the importance of storytelling and the impact of their film.,2019,,10,['documentation'],['US'],,,,,2.061,5.5"
"tm675214,Mokalik (Mechanic),MOVIE,Mokalik' follows the career of an 11-year-old boy  Ponmile  from the middle-class suburbs who spends the day as a lowly apprentice at a mechanic workshop in order to view life from the other side of the tracks - When his father arrives to take him home,,,,,,,,,,,"
"tm677904,2 Weeks in Lagos,MOVIE,2 Weeks in Lagos is a turbulent and thrilling journey into the lives of Ejikeme and Lola. Their lives collide when Ejikeme  an investment banker  comes home from the United States with Lola's brother Charlie to invest in Nigerian businesses. 2 Weeks in Lagos captures the excitement  vibrancy  and complexity of everyday life in Lagos  a dynamic city where anything is possible in 2 weeks.,2019,,107,['romance'],['NG'],,tt10241024,6.6,33.0,0.72,"
"tm890479,The Claudia Kishi Club,MOVIE,""Asian American creatives pay passionate tribute to the iconic  stereotype-busting """"Baby-Sitters Club"""" character in this heartfelt documentary short."",2020,,17,['documentation'],['US'],,tt12411586,,,3.058,4.7"
"tm936519,Soulmate,MOVIE,A romantic film presenting a love story that is both sweet and bitter. Can love be found amidst clashes and troubles?,2020,,106,['romance'],['EG'],,,,,1.54,5.8"
"tm834653,The Knight and the Princess,MOVIE,An unwavering young warrior's determination to save women and children abducted by pirates  leads him to his sweetheart and to confront a brutal tyrant and his devious sorcerer.,2019,PG,97,['comedy'  'family'  'fantasy'  'history'  'animation'],['EG'  'SA'],,tt13819560,5.9,375.0,2.567,"
"tm472961,After Maria,MOVIE,Strong Puerto Rican women forced to flee the island after Hurricane Maria have bonded like family in a FEMA hotel in the Bronx. They seek stability in their new life as forces try to pull them apart.,2019,,36,['documentation'],['US'],,,,,2.893,5.5"
"tm852207,3 Logical Exits,MOVIE,""A sociological meditation on the different """"exits"""" that young Palestinians choose  in order to cope with life in the refugee camps."",2020,,15,['documentation'],['LB'  'GB'  'DK'],,,,,0.907,"
"tm945831,The Magic School Bus Rides Again: The Frizz Connection,MOVIE,Lightning splits the Magic School Bus into three pieces  scattering the class across the globe with different versions of Ms. Frizzle aboard each bus!,2020,,44,['animation'  'family'],['US'],,tt13150612,,,3.397,7.7"
"tm882222,Kalek Shanab,MOVIE,Three young men wake up from sleep  all three discover that they are in strange places and unfamiliar to them  and try to find out what happened in the past hours.,2019,PG-13,80,['comedy'],['AE'],,,,,1.165,"
"tm840152,Amsterdam to Anatolia,MOVIE,,2019,,6,['thriller'],['NL'  'PS'  'US'  'LB'],,,,,0.731,6.0"
"tm1113921,In Vitro,MOVIE,In Vitro' is an otherworldly rumination on memory  history  place and identity set in Bethlehem decades after an eco-disaster.,2019,,27,[],[],,tt10545994,7.7,,,"
"tm1030742,One Like It,MOVIE,This short film follows a day in the life of a young woman in Egypt and how her interactions with others expose long-standing stereotypes and biases.,2020,,14,[],[],,,,,0.6,6.0"
"tm1031016,Marked,MOVIE,This documentary explores Nigeria's cultural practice of marking  including its origins and meaning as a symbol of identity  beauty and spirituality.,2019,,20,['documentation'],['NG'],,tt10519534,,,0.685,"
"tm878495,Kambili: The Whole 30 Yards,MOVIE,Kambili Maduka  is an irresponsible  spoiled  spendthrift 28-year-old woman who is turning 29 in a few days. The only thing on her mind is to get married before she turns 30. However  after getting suspended from work due to her incessant lateness  she goes on a date with her boyfriend and he breaks up with her  dashing her hopes of getting married before 30. She decides that what she needs to do is prove to her boyfriend that she can be everything he wants her to be which is,,,,,,,,,,,"
"tm1068745,Finding Hubby,MOVIE,The adventures of 35-year-old Oyin Clegg and her friends Toke and Gloria as they kiss the many frogs in the quest to find their prince. In the process  they are forced to ask important questions about their friendship  love and life ultimately asking - finding hubby or finding happy?,2020,,104,['comedy'],['NG'],,,,,1.332,3.0"
"tm916008,PNL - Dans la légende tour,MOVIE,""Live recording of French rapper PNL playing songs from their album """"Dans la légende"""" and more at the Bercy Arena in Paris."",2020,,18,['documentation'  'music'],['FR'],,,,,2.385,6.2"
"tm476593,Krutant,MOVIE,When a busy workaholic leaves town to meet friends  an unexpected delay leads him to the hut of an old man  whose haunting tale could change his life.,2019,,116,['drama'  'thriller'],['IN'],,tt9575388,6.4,104.0,1.14,"
"tm855232,Luccas Neto in: The End of Christmas,MOVIE,,2019,,71,[],[],,,,,1.38,7.8"
"tm942492,Super Monsters: Dia de los Monsters,MOVIE,The Super Monsters celebrate Día de los Muertos in Vida’s hometown with her magical family  some new monster friends and a spook-tacular parade!,2020,G,25,['animation'],['US'  'CA'],,,,,4.43,7.6"
"tm483103,Ali & Alia,MOVIE,Ali and Alia are childhood neighbors that fell in love with each other  but bigger events occur in their lives which gets them separated. Ali seeks to maintain Alia's heart even if it is through substance abuse.,2019,PG-13,105,['romance'  'drama'],['EG'],,tt9859758,5.0,33.0,0.606,"
"tm888850,Blue  Painful  and Brittle,MOVIE,""Two outsider college students set up a secret society circle  """"Moai """" which aims to change the world. But one day  one of them disappears."",2020,,118,['action'],['JP'],,,,,1.809,6.0"
"tm826677,Tee Shot: Ariya Jutanugarn,MOVIE,This biopic follows pro golfer Ariya Jutanugarn's journey to the LPGA tour  from child prodigy to her number-one ranking in the world.,2019,,103,['drama'],['TH'],,,,,1.4,6.2"
"tm833361,True: Tricky Treat Day,MOVIE,It's up to True and her friends to save the day when a hungry Yeti sneaks a forbidden treat and fills the kingdom with Howling Greenies.,2019,,23,['animation'  'family'],[],,tt10927572,,,1.873,7.0"
"tm483190,Time Out,MOVIE,A woman who works as a DJ is known to live alone and has her own messy world  but when she meets a teacher who is always serious and well organized  the contradiction between their personalities result in many comedic situations.,2019,,93,['comedy'  'drama'  'romance'],[],,tt9822904,5.9,45.0,,"
"tm1088545,Unroyal,MOVIE,When a rude and arrogant princess finds herself relying on a gatekeeper after a terrible accident  it may be enough to make her change her ways.,2020,,97,['drama'  'romance'  'comedy'],['NG'],,tt15526612,,,0.615,"
"tm833555,Park Na-rae: Glamour Warning,MOVIE,Korea's beloved comedian and favorite big sister figure talks sex  relationships and celebrity life. And she's sassier and dirtier than ever before.,2019,,62,['comedy'],['KR'],,,,,1.376,5.8"
"tm885938,Mauricio Meirelles: Generating Chaos,MOVIE,He's mid-30s going on 79  with scathingly funny views on fatherhood  marriage and society. Let Maurício Meirelles give you a tour of his chaotic mind.,2020,,63,['comedy'],['BR'],,,,,1.871,7.7"
"tm922943,Beyond the Boundary: ICC Women's T20 World Cup Australia 2020,MOVIE,The ICC Women's T20 World Cup 2020 was a landmark event in the history of cricket and all women's sport. The ICC partnered with Netflix to capture the action  excitement and emotion of the event in a documentary.,2020,,59,['documentation'  'sport'],['AU'],,tt15929232,,,1.168,"
"tm944561,Rooting for Roona,MOVIE,In rural India  a child with hydrocephalus gets a chance at life-changing surgery after her photos go viral. This documentary charts her journey.,2020,,40,['documentation'],[],,,,,4.414,7.4"
"tm873655,Your Excellency,MOVIE,The movie entails generally on the west African country Nigeria which is about conducting an election for the 13th Democratic president of the country. It entails about the happenings in the country's political sector and the country at large during the general elections.,2019,,120,['comedy'],['NG'],,tt11489288,6.6,43.0,1.743,"
"tm837042,""Hoshino Gen Dome Tour """"POP VIRUS"""" at Tokyo Dome"",MOVIE,All venue tickets sold out on the same day  for 5 major dome concerts of Hoshino Genso's “POP VIRUS” seen by 330 000 people! This Netflix special shows the performance of Tokyo Dome  focusing on songs from the latest album “POP VIRUS”  NHK Asadora theme song “Idea”  blockbuster song “SUN”  as well as Hoshino's unique music portfolio  including “Koi”  “Family Song”  “Doraemon”  with choreography by MIKIKO (Elevenplay) and more  on a setlist of 23 songs  including encore. The content is plentiful enough to pack the charm of the dome performance.,2019,G,120,['documentation'  'music'],['JP'],,,,,1.701,7.0"
"tm896976,True: Rainbow Rescue,MOVIE,,2020,,23,['animation'],['US'],,,,,3.517,10.0"
"tm498444,Nimbe: The Movie,MOVIE,Nimbe is a story addressing the issues associated with drug abuse  some of the causes  how to identify and avoid such.,2019,,110,['drama'],[],,tt8718112,5.9,57.0,,"
"tm823848,Mohamed Hussein,MOVIE,""Mohamed Hussein  a chauffeur at a 5-star hotel  is accused by the police of murdering a famous painter who had just arrived from Paris and was staying at the hotel where he works  since he was the last person to come in contact with him. Before his death  the painter sketches a grand painting on Mohamed's back which draws the attention of a mob who are now after his """"back-painting""""."",2019,,96,['comedy'],['EG'],,,,,1.421,7.2"
"tm918704,Baxu and the Giants,MOVIE,A story of how Rhino Poaching triggers social change in rural Namibia  seen through the eyes of a 9 year old girl.,2019,,29,['drama'  'fantasy'],['NA'],,,,,1.565,"
"tm1080554,Rudra: Secret of the Black Moon,MOVIE,Kid magician Rudra sets out to save Earth from the demon of Black Moon planet  but can he get the job done if his spells don't work on enemy territory?,2020,,87,[],[],,,,,0.6,"
"tm989205,Ratones Paranoicos: The Band That Rocked Argentina,MOVIE,The irrepressible Ratones Paranoicos  Argentina's most enduring rock band  are featured in vintage concert and backstage footage as their story's told.,2019,,76,['documentation'  'music'],['AR'],,,,,2.059,"
"tm853091,The American Game,MOVIE,In a mold of romantic comedy  a young man and girl struggle with many material and social difficulties in trying to conclude their marriage  and unexpectedly  the owner of the company they work for offers an alluring offer that helps them solve all their problems  but he will put their love to the test.,2019,,92,['comedy'],['EG'],,,,,0.988,5.0"
"tm919210,Uma Maheswara Ugra Roopasya,MOVIE,Defeated and humiliated in a fight while trying to defuse a conflict among his fellow villagers  a photographer vows revenge on his attacker.,2020,,136,['drama'  'comedy'],['IN'],,,,,2.663,6.8"
"tm1028068,Wave of Cinema: Generasi 90an,MOVIE,""Walk down memory lane and experience the soundtrack to beloved film """"Generasi 90an: Melankolia"""" through nostalgic performances."",2020,,51,['music'],['ID'],,,,,0.6,"
"ts223078,Nailed It! Spain,SHOW,On this competition show  novice bakers try to avoid a fiasco while duplicating stunning sweets. At stake are a trophy and 5 000 euros.,2019,TV-PG,31,['reality'],['US'],1.0,,,,3.026,7.1"
"tm849565,Generasi 90an: Melankolia,MOVIE,After the devastating loss of a loved one  Abby forms a bond with his sister's best friend as he struggles to move on.,2020,,94,['drama'],['ID'],,,,,3.272,7.0"
"tm1000166,Wave of Cinema: Surat Dari Timur,MOVIE,Featuring a mix of film footage and special performances  this virtual concert honors the memory and music of revered Indonesian singer Glenn Fredly.,2020,,57,['music'],['ID'],,,,,0.908,"
"ts222838,I'm with the Band: Nasty Cherry,SHOW,In an unfiltered  intimate docuseries  pop star mentor Charli XCX finds out what it takes to build -- and break -- a real  badass all-girl punk band.,2019,TV-MA,0,['reality'],['US'],1.0,,,,3.873,7.2"
"tm873357,Mariposa,MOVIE,Iqbal (Angga Yunanda) is like a Mariposa butterfly to Acha (Adhisty Zara). Each time someone approach  he always runs away. Acha is determined to win Iqbal  a man known to be handsome  smart  yet cold.,2020,,117,['drama'  'romance'  'comedy'],[],,tt11470064,7.7,700.0,,"
"ts255823,The House Arrest of Us,SHOW,A long-term couple finally decides to get engaged  and per Filipino pre-wedding tradition  the groom-to-be and his family go to his fiancée's family to settle the union. A series of unfortunate events follow as a pandemic hits  with the government suddenly implementing an Enhanced Community Quarantine. Now the would-be bride and groom  joined by their warring families  must live under one roof during a mandated lockdown.,2020,TV-PG,26,['comedy'  'romance'],['PH'],1.0,tt13280838,5.6,107.0,2.586,"
"tm856372,The Book of Sun,MOVIE,In 2010  at the peak of the Saudi YouTube movement  high school senior Husam finds himself drawn into the world of video production. He’s joined in his pursuit by his best friend Maan  their one-time foe Ibrahim  and Orabi a teacher with a passion for filmmaking. In the middle of their senior year  they set out to produce a no-budget horror movie – a wild adventure that will put their futures at risk.,2020,,130,['thriller'],['SA'],,,,,2.719,8.1"
"tm493556,Kaagar,MOVIE,In a small Maharashtrian town  a woman's rise in the political hierarchy creates ripples across the social-political spectrum. Directed by Makarand Mane  KaaGaR stars Rinku Rajguru in the lead role.,2019,,129,['crime'  'drama'],['IN'],,tt8907844,6.2,64.0,0.6,"
"tm971819,Four Sisters Before the Wedding,MOVIE,""After discovering that their parents' marriage is on the brink of ending  the Salazar siblings scheme to bring them back together in time for their 20th anniversary in a prequel to """"Four Sisters and a Wedding."""""",2020,,116,['drama'  'comedy'],[],,tt11867144,6.3,172.0,,"
"tm1073298,Awon Boyz,MOVIE,This documentary takes a close look at the lives and passions of the men and boys who hustle or run with a gang on the streets of Lagos.,2019,,39,['documentation'],['NG'],,,,,0.625,"
"ts89531,That's What Happened,SHOW,The events of the series revolve within a social dramatic framework during a time period of up to 100 years ago  approximately (1918: 2018)  about the suffering women encounter in general  and Sa’idiyya in particular  and the different ideas  customs and traditions  and other social issues that concern women.,2019,TV-14,39,[],[],1.0,,,,1.613,8.0"
"tm869307,Three Thieves,MOVIE,Due to a case of mistaken identity  three dissatisfied friends are contracted to commit a seemingly simple theft. Even worse  the man originally contracted for the job is on the hunt for them.,2019,,108,['comedy'],['NG'],,tt11133472,,,0.944,"
"tm979073,100% Halal,MOVIE,After high school  a young woman marries the man of her father's choice but soon faces the possibility that her religion considers the union invalid.,2020,,100,['drama'],['ID'],,,,,1.511,"
"tm1041549,Dear Affy,MOVIE,An engaged couple hit a number of speed bumps on their road to matrimony including major career complications and questions of fidelity.,2020,,126,['romance'  'comedy'],['NG'],,tt14928724,,,1.999,"
"ts90648,I Have A Script,SHOW,After the death of a loved one  a woman decides to pursue her passion for writing by penning television scripts.,2019,TV-14,45,['drama'],['KW'],1.0,,,,2.642,10.0"
"tm470687,Loving is Losing,MOVIE,When a newly single photographer is forced to work with a longtime rival  the battle of their egos turns into a chance for love.,2019,,91,[],['CO'],,,,,0.759,4.8"
"tm471802,Sur Sapata,MOVIE,This story is about young boys who have capabilities of playing KABADDI but the society is against them  they took this as challenge and their journey starts from here. Boys went out of the box after facing hardship and being discouraged from their guru and parents to win hearts of people. To feel the thrill  motivation  entertainment  comedy  sportsmanship,,,,,,,,,,,"
"tm873354,Si Doel the Movie 3,MOVIE,The return of Sarah with his son  Dul  to Jakarta  welcomed happily by the Doel's family. But it also makes Zaenab  Sarah  and Doel confronted with decisive choice.,2020,,93,['drama'  'romance'],[],,tt11469660,6.7,130.0,,"
"tm902993,Mama Drama,MOVIE,,2020,,85,['drama'],['US'],,tt12424356,6.3,8.0,,"
"tm843408,She Is,MOVIE,Can one woman have everything? Facing her 40s  a highly accomplished woman  with a host of suitors at her feet  faces hard decisions about love  family  and her future.,2019,,106,['drama'],[],,tt14605914,5.8,6.0,0.6,"
"tm898322,This Lady Called Life,MOVIE,Becoming a chef is Aiye’s greatest desire. But. She is a young  struggling  single mother who has been abandoned by her family. To settle for defeat  or to fight against all odds to become the chef of her dreams? That is the question.,2020,,120,['drama'],['NG'],,tt12282600,6.8,62.0,1.475,"
"ts304136,마법버스 타요,SHOW,,2020,TV-Y7,24,[],['KR'],1.0,,,,0.6,"
