"ts255677,Pucca: Love Recipe,SHOW,There is an over-arching plot detailing the rivalry between the Goh-Rong Restaurant and the Sooga Island location of a multi-national restaurant chain called Dong King Restaurant. Ring Ring  a local 12-year old fashion star  who appeared in the Jetix show and also appeared as Pucca's rival for Garu's affections  is revealed to be the daughter of Dong King and at times works for him  while also directing his servants against Pucca. These servants  under the command of the Dong King Restaurant's manager  Fyah  continually attempt to steal the Goh-Rong's customers by means of various dirty tricks  including occasionally hiring villains such as Tobe and his ninjas or The Pirates.,2018,TV-Y7,24,['comedy'],[],1.0,,,,14.26,"
"ts82591,Spiritual House,SHOW,Psychic Hiroyuki Ehara leads various celebrities through spiritual consultations  probing into their issues and spotlighting their accomplishments.,2017,TV-PG,41,[],['JP'],1.0,,,,0.6,"
"tm431214,Back to Q82,MOVIE,Eager to rejoin her divorced parents  an inventor's daughter drives his time-traveling car back to 1982. But a secret crush accidentally follows.,2017,,105,['scifi'  'action'  'comedy'],['KW'],,tt6225842,6.0,94.0,0.6,"
"ts119220,The Hollywood Masters,SHOW,Personal. Provocative. Hollywood's greatest successes reveal the secrets behind their careers.,2017,TV-MA,34,['documentation'],['US'],3.0,tt7178034,7.2,86.0,0.6,"
"tm428982,Son Of Adam,MOVIE,To escape conviction on criminal charges  a businessman agrees to aid a risky police mission  but his motives soon turn suspicious.,2018,,109,['thriller'],['EG'],,,,,1.459,6.0"
"tm447263,Super Monsters and the Wish Star,MOVIE,Christmas wishes come true for Lobo  whose favorite cousin arrives for a surprise visit  and for Glorb  who wishes he could be everywhere at once!,2018,,27,['fantasy'],['US'],,,,,2.821,6.0"
"ts106612,Chicken Soup for the Soul's Being Dad,SHOW,,2018,TV-PG,40,['reality'],[],1.0,tt8908110,,,,"
"tm352642,Bonboné,MOVIE,A Palestinian couple resorts to an unusual way to conceive as the husband is detained in an Israeli jail where visits are restricted.,2018,,15,['comedy'  'drama'],['LB'  'PS'],,,,,1.753,"
"tm1073482,Motu Patlu Kung Fu Kings 4 The Challenge of Kung Fu Brothers,MOVIE,While in Japan  best friends Motu and Patlu have only one month to train for an epic martial arts battle against two wicked but highly skilled brothers.,2018,G,86,[],[],,,,,1.4,10.0"
"ts55735,The Perfect Match,SHOW,What do netizens know? Ting En (Chris Wu) is a celebrated chef whose fine-dining restaurant is a destination for food lovers from all over the world. When Ting En stumbles upon comments on the Internet from people who can’t afford to eat at his high-priced restaurant  they blow his mind. Netizens claim that the culinary creations made by Fen Qing (Ivy Shao) at the night market are just as satisfying as Ting En’s Michelin-worthy food. Determined to debunk such preposterous claims  Ting En goes to the night market to find Fen Qing and show her what true culinary talent really is. Whose cuisine will reign supreme? “The Perfect Match” is a 2017 Taiwanese drama series.,2017,TV-14,44,['comedy'  'drama'],['TW'],1.0,,,,2.684,7.4"
"tm1118527,Shiva VS Autobots,MOVIE,When an evil enemy gains control of a gadget that sends vehicles destructively spinning out of control  kid superhero Shiva must stop the chaos!,2018,,79,[],[],,,,,0.626,"
"tm321563,A Drowning Man,MOVIE,Alone and far from home  The Kid makes his way through a strange city looking for the means to get through his day. Surrounded by predators he is forced to make compromises merely to survive  his life of exile grows one day longer.,2017,,15,['drama'],['DK'  'GR'  'GB'],,,,,1.101,5.6"
"tm411649,Thug Life,MOVIE,A get-rich-quick scheme goes awry when a group of friends stumbles onto a dangerous conspiracy and wind up getting mistaken for the bad guys.,2017,,134,['comedy'  'drama'],['IN'],,tt9537072,5.7,48.0,0.932,"
"tm404610,Stretch Armstrong: The Breakout,MOVIE,Villains are rampaging through Charter City and the Flex Fighters -- Jake  Ricardo and Nathan -- need your help to halt the chaos.,2018,,45,['animation'],['US'],,,,,1.982,6.0"
"tm448690,Prince of Peoria: A Christmas Moose Miracle,MOVIE,""Teddy gets snowed in at a bowling alley  which may cause him to miss the Festival of Lights for the very first time. Fear not  though  because Emil """"insists the Christmas moose will save the day."",2018,,29,['comedy'],[],,,,,1.175,5.8"
"tm840936,Zoé: Panoramas,MOVIE,A unique and introspective look inside one of Latin America's biggest rock bands: Zoé. The film takes you on a contemplative and audiovisual journey through one of the bands decisive years.,2017,PG,89,['music'  'documentation'],['XX'],,tt5158844,6.8,77.0,,"
"tm450512,Pinky Memsaab,MOVIE,The lives of a gullible maid,,,,,,,,,,,"
"tm429383,Yoo Byung Jae: Discomfort Zone,MOVIE,Daring comedian Yoo Byung-jae connects criticism he's received from the general public to some of the most touchy issues in current Korean society.,2018,,54,['comedy'],['KR'],,,,,0.792,6.4"
"tm440208,Hadithi za Kumekucha: Fatuma,MOVIE,A woman single-handedly shoulders her family's burdens  without reward or thanks  to farm her husband's land and keep the family fed and cared for. She finds herself training her daughter to walk the same path she does. No school  all work. Pests threaten her harvest and are exterminated using a loan from the local women's Co-op. But when Manyusi squanders her prized harvest and schemes to marry off their daughter  Fatuma must enlist the help of her fellow ladies at the co-op to make things right.,2018,,85,['drama'],['TZ'],,tt8329296,7.6,8.0,1.536,"
"tm362737,Facing Mecca,MOVIE,Pensioner Roli comes to Fareed's assistance when the Syrian refugee is faced with the burial of his Muslim wife. Together they stumble into a bewildering forest of Swiss bureaucracy to which Roli finds beautifully simple answer.,2017,,25,['drama'],['CH'],,,,,1.489,5.6"
"tm480647,Ayana,MOVIE,An ambitious software entrepreneur puts everything he has in line to perceive his dreams.,2017,,112,['drama'  'documentation'],['KG'],,tt6891660,7.4,128.0,0.618,"
"tm479734,Table Manners,MOVIE,Family  food and love. Life's three courses made easy.,2018,,105,['comedy'  'drama'],['ZA'  'CA'],,tt7385538,5.1,43.0,1.486,"
"tm349140,Joaquín Reyes: Una y no más,MOVIE,Comedian and celebrity impersonator Joaquín Reyes decides to be his zesty self for a night of stories about buses  bathroom habits  royalty and more.,2017,,77,['comedy'],[],,,,,1.18,6.0"
"tm471288,Baby Mamas,MOVIE,The daily lives and loves of four professional women in South Africa who are all in different stages of their own real-life baby mama drama.,2018,,93,['drama'  'comedy'],['ZA'],,tt8686460,6.6,63.0,0.6,"
"tm494577,Oga Bolaji,MOVIE,""Oga Bolaji is a story that is centered around the simple happy go lucky life of a 40-year-old retired musician """"Gold Ikponmosa"""". His life takes a drastic turn when he crosses paths with a young girl. Perhaps it leads to the worst or best part of his life. Oga Bolaji showcases the resilient  ingenuity of the Nigerian spirit. The way we live  our pain  our limitations  yet we continue to strive  we continue to hope and we continue to dream."",2018,,91,['drama'],['NG'],,tt8847418,,,0.6,"
"tm479933,Project Papa,MOVIE,When a busy entrepreneur pauses her career to spend time with her aging father  both learn valuable lessons on happiness  love and living in the moment.,2018,G,97,['drama'],['XX'],,tt7243756,6.3,35.0,1.4,"
"ts81828,True: Wonderful Wishes,SHOW,Do-gooding True and Bartleby will go anywhere to make wishes come true -- from the bottom of the Living Sea to the tip of Mount Tippy Tippy Top!,2018,TV-Y,23,['animation'],['US'],1.0,,,,1.168,"
"tm512751,In Line,MOVIE,A man returns from prison hoping to pick up the pieces of his life with his wife and business. Things are not as he hopes when he begins to suspect his wife of infidelity and with the business at stake,,,,,,,,,,,"
"tm447915,Little Singham aur Kaal ka Mahajaal,MOVIE,When Kaal  the vilest demon on earth  threatens to destroy his village  child cop Little Singham must use his strength and smarts to fight back.,2018,,68,['comedy'],[],,,,,0.96,"
"tm452767,Next Enti?,MOVIE,Tammy ‘hates boys’ and will only settle for the kind of standards her father sets for her,,,,,,,,,,,"
"ts236619,Loo Loo Kids Johny & Friends Musical Adventure,SHOW,Music-loving baby Johny goes on dance-filled adventures with his family  friends and adorable critters in this colorful  animated preschooler series. Watch all you want.,2018,TV-Y,3,[],['US'],1.0,,,,1.168,10.0"
"ts119730,Luo Bao Bei,SHOW,The story is about a 7-year-old Luo Bao Bei as she navigates childhood and the world around her. Fantasy and dreams add elements of surrealism.,2018,TV-Y,11,['animation'],[],1.0,tt7192414,8.0,38.0,,"
"ts268283,RIDE ON TIME,SHOW,,2018,TV-PG,24,[],['JP'],3.0,,,,1.524,"
"ts104093,Dance & Sing With True,SHOW,True and her friends are making music -- and they want you to dance and sing along. So cut loose  silly goose! These fun beats are totally sweet.,2018,,0,['animation'  'family'],[],1.0,tt9315892,,,1.96,10.0"
"ts86360,Pretty Man,SHOW,It tells the love story of Lu Jin Nian and Qiao An Hao spanning 13 years. They first got to know each other in school  but later parted ways again due to some misunderstandings. Now  Jin Nian is the unapproachable king of the entertainment business while An Hao is a rookie in the same business. Fate lets Jin Nian and An Hao meet again and An Hao ends up becoming his fake wife.,2018,TV-14,35,['family'],['CN'],2.0,,,,4.429,8.5"
"tm834886,Wedy Atkalam,MOVIE,A film Director named Masoud faces the negative changes that occurred in the Kuwaiti society  and tries to fight them through art.,2018,,72,['drama'  'comedy'],['KW'],,tt9437052,5.8,17.0,,"
"tm478967,Until Midnight,MOVIE,When Salem  A newly wed man returns home  He finds an unexpected visitor with sinister intentions.,2018,R,78,['drama'  'thriller'],['AE'],,tt7741602,6.9,717.0,0.718,"
"tm364525,Beat Bugs: All Together Now,MOVIE,""After winning a local talent show  the Beat Bugs journey to compete on """"The Bug Factor """" a televised singing contest held in faraway Rocket Ship Park."",2017,,50,['animation'],['US'],,,,,3.844,5.6"
"tm1073433,Shiva: The Secret World Of Vedas City,MOVIE,When the residents of Vedas are ordered to evacuate by a prince who claims the town as his own  young Shiva sets out to save the city and its citizens.,2017,G,78,[],[],,,,,0.733,"
"tm422510,Al-Khawaga's Dilemma,MOVIE,The film revolves around a poor and ambitious young man who shares a love story with the daughter of a businessman with influence and money.,2018,,110,['drama'],['EG'],,,,,0.84,6.0"
"tm1073233,Motu Patlu in the City of Gold,MOVIE,Defeated by the strong yet naive Motu in a race  an evil horseback rider challenges him to a more dangerous mission: finding a lost city of treasure!,2018,G,77,[],[],,,,,0.609,"
"tm858471,The Bridge,MOVIE,Obadare  a Yoruba prince and Stella  a young lady from a distinguished Igbo family are a couple whose relationship is threatened by tribal prejudice and parental plans for each's life. When the couple secretly weds against their parents' wishes  the consequence shakes the very foundation and sustenance of both families.,2017,,115,['romance'  'drama'],['CA'],,tt8193396,5.6,36.0,0.6,"
"tm493814,Satria Heroes: Revenge of the Darkness,MOVIE,One year has passed since Satria Garuda Bima-X defeated VUDO and the earth is in peace again. Ray and Rena are rebuilding the Parallel World again. However  new evil forces attack and old enemies rise again to devastate the earth.,2017,,92,['drama'  'fantasy'  'scifi'  'action'],['ID'],,tt9033440,4.4,69.0,,"
"tm491499,Fan of Amoory,MOVIE,A story about a brave talented boy,,,,,,,,,,,"
"ts250172,Afronta!,SHOW,Afronta invites contemporary black artists and thinkers to discuss representation  belonging  entrepreneurship  ancestrality and AFROFUTURISM through their experiences and personal histories. These reflections will contribute to the understanding of how the Brazilian black community is creating a network to promote the autonomy to change our reality of today  while inventing one for tomorrow.,2017,TV-PG,0,['documentation'],['BR'],1.0,tt12467250,7.4,8.0,0.6,"
"ts231159,Learning Songs by Little Baby Bum: Nursery Rhyme Friends,SHOW,Simple songs mix with colorful animation to teach youngsters about concepts such as animals  vehicles  numbers  colors and more.,2017,TV-Y,30,['music'  'animation'  'family'],[],1.0,tt11456582,4.2,9.0,0.6,"
"tm478701,Lara and the Beat,MOVIE,Lara and the Beat is a coming of age movie about the young and beautiful Giwa sisters caught in the center of a financial scandal with their late parents' Media Empire. The sisters are forced out of their privileged bubble  and must learn to build their own future - through music and enterprise - to salvage their family's Legacy.,2018,,137,['drama'  'music'  'romance'],['NG'],,tt7819668,6.7,146.0,0.936,"
"tm1146751,Bahasha,MOVIE,Bahasha is the story of Kitasa  an elected public official who betrays his family  friends and community when he takes an easy bribe. He learns the hard way and must now find the road to redemption.,2018,,85,['drama'],['TZ'],,tt8627254,7.0,23.0,,"
"tm463592,Little Miss Sumo,MOVIE,In an ancient sport traditionally reserved for men  20-year-old female sumo prodigy Hiyori attempts to revolutionize Japan’s national pastime.,2018,,18,['documentation'],['JP'  'GB'],,,,,3.403,5.8"
"ts221016,Top Boy,SHOW,Two seasoned drug dealers return to the gritty street of London  but their pursuit of money and power is threatened by a young and ruthless hustler.,2019,TV-MA,44,['drama'],['GB'],3.0,,,,34.043,8.4"
"ts84633,The Promised Neverland,SHOW,""Surrounded by a forest and a gated entrance  the Grace Field House is inhabited by orphans happily living together as one big family  looked after by their """"Mama """" Isabella. Although they are required to take tests daily  the children are free to spend their time as they see fit  usually playing outside  as long as they do not venture too far from the orphanage — a rule they are expected to follow no matter what. However  all good times must come to an end  as every few months  a child is adopted and sent to live with their new family... never to be heard from again."",,,,,,,,,,,"
"ts222439,Crash Landing on You,SHOW,A paragliding mishap drops a South Korean heiress in North Korea -- and into the life of an army officer  who decides he will help her hide.,2019,,86,['drama'],['KR'],1.0,,,,48.795,8.8"
"ts90448,The Hateful Eight: Extended Version,SHOW,Trapped at a stagecoach stop as a storm rages outside  two bounty hunters and an outlaw face a gallery of rogues. Features never-before-seen footage.,2019,TV-MA,199,['western'  'crime'  'thriller'  'drama'],['US'],1.0,,,,1.96,10.0"
"ts223548,The Midnight Gospel,SHOW,Traversing trippy worlds inside his universe simulator  Clancy the space caster explores existential questions about life  death and everything in between.,2020,TV-MA,25,['scifi'],['US'],1.0,,,,29.669,8.4"
"ts222988,Love on the Spectrum,SHOW,Seven singles take their first steps into the world of dating,,,,,,,,,,,"
"ts223530,Sweet Home,SHOW,As humans turn into savage monsters and wreak terror  one troubled teen and his apartment neighbors fight to survive — and to hold on to their humanity.,2020,TV-MA,52,['scifi'],['KR'],1.0,,,,74.635,8.6"
"tm836438,Countdown,MOVIE,A young nurse downloads an app that tells her she only has three days to live. With time ticking away and a mysterious figure haunting her  she must find a way to save her life before time runs out.,2019,PG-13,90,['horror'  'thriller'  'european'],['US'],,,,,34.6,6.4"
"ts236685,Lies and Deceit,SHOW,A literature teacher suspects that a well-respected surgeon has drugged her and begins a legal case against him.,2020,,49,['thriller'],['ES'],1.0,,,,27.359,4.3"
"ts237499,The Woods,SHOW,Paul Copeland is looking to solve the murder of his sister back in 1994.,2020,TV-MA,43,['drama'],['PL'],1.0,,,,9.011,7.1"
"tm877681,American Pie Presents: Girls' Rules,MOVIE,It's Senior year at East Great Falls. Annie  Kayla  Michelle  and Stephanie decide to harness their girl power and band together to get what they want their last year of high school.,2020,R,95,['comedy'],['US'],,tt11771594,,,55.783,6.4"
"ts225867,The English Game,SHOW,Two 19th-century footballers on opposite sides of a class divide navigate professional and personal turmoil to change the game — and England — forever.,2020,TV-14,48,['drama'],['GB'],1.0,,,,13.462,7.7"
"ts255427,Blood of Zeus,SHOW,In a brewing war between the gods of Olympus and the titans  Heron  a commoner living on the outskirts of ancient Greece  becomes mankind's best hope of surviving an evil demon army  when he discovers the secrets of his past.,2020,TV-MA,32,['action'  'scifi'],['US'],1.0,,,,32.283,8.1"
"tm853953,Tremors: Shrieker Island,MOVIE,Graboids are illegally taken to a new island resort by a rich playboy as a dangerous form of trophy hunting  and Burt Gummer steps up to save the day.,2020,PG-13,103,['horror'],['US'],,,,,16.143,6.4"
"tm863280,Showtime 1958,MOVIE,The true story behind the iconic Selamat Hari Raya song written in 1958  by P. Ramlee and Jamil Sulong during a variety show which they had organised to collect funds for fellow performers and friends who had lost their jobs at the studio.,2020,,109,['drama'],['MY'],,tt11900444,,,3.438,"
"ts251654,Paranormal,SHOW,After a sceptical haematologist is plunged into a series of inexplicable events  he unwillingly becomes the go-to-guy for paranormal investigations.,2020,TV-14,56,['scifi'],['EG'],1.0,,,,8.112,7.3"
"ts268799,Equinox,SHOW,Haunted by visions after her sister vanished with her classmates 21 years before  Astrid begins an investigation that uncovers the dark  eerie truth.,2020,,46,['scifi'],['DK'],1.0,,,,19.592,7.5"
"tm426638,Vita & Virginia,MOVIE,Socialite Vita Sackville-West and literary icon Virginia Woolf run in different circles in 1920s London. Despite the odds  the magnetic Vita and the beguiling Virginia forge an unconventional affair  set against the backdrop of their own strikingly contemporary marriages,,,,,,,,,,,"
"tm845512,Horse Girl,MOVIE,A socially awkward woman with a fondness for arts and crafts  horses  and supernatural crime shows finds her increasingly lucid dreams trickling into her waking life.,2020,R,104,['drama'],['US'],,,,,19.692,5.6"
"tm926004,The Boss Baby: Get That Baby!,MOVIE,Think you've got what it takes to be the boss? This interactive special puts your skills to the test and matches you up with one of 16 jobs at Baby Corp.,2020,,24,['animation'],['US'],,,,,46.316,6.9"
"tm817504,1BR,MOVIE,When Sarah lucks into a sweet one-bedroom at Asilo Del Mar Apartments in Los Angeles  she think she's hit the jackpot. It's got plenty of space  friendly tenants  group BBQs and even a cute neighbour next door. All is not what it seems: loud noises start keeping her awake at night,,,,,,,,,,,"
"ts272134,Transformers: War for Cybertron: Earthrise,SHOW,While Megatron takes drastic measures to save the Decepticons  the Autobots fight to save all of Cybertron from both on the planet and aboard the Ark.,2020,TV-Y7,24,['action'  'scifi'],['US'],1.0,,,,11.742,8.1"
"ts215341,The Gentlemen's League,SHOW,These former sports superstars were record-breaking Olympians,,,,,,,,,,,"
"tm847430,Words Bubble Up Like Soda Pop,MOVIE,After meeting one bright  sunny day  a shy boy who expresses himself through haiku and a bubbly but self-conscious girl share a brief  magical summer.,2020,,87,['drama'],['JP'],,,,,22.9,7.4"
"tm819950,Anima,MOVIE,In a short musical film directed by Paul Thomas Anderson  Thom Yorke of Radiohead stars in a mind-bending visual piece. Best played loud.,2019,,15,['music'],['CZ'  'FR'  'GB'],,tt10516984,,,6.23,7.4"
"ts227385,Transformers: War for Cybertron: Siege,SHOW,On their dying planet  the Autobots and Decepticons battle fiercely for control of the AllSpark in the Transformers universe's origin story.,2020,TV-14,13,['scifi'],['US'],3.0,,,,34.608,7.6"
"tm935878,Monsoon,MOVIE,Kit can’t remember much of his native Vietnam. When he returns to the Land of the Golden Star for the first time in over thirty years  he takes in his local surroundings as any Western tourist would  and the environment is as exotic as the language is incomprehensible. The aim of Kit’s travels – to find a place to scatter his parents’ ashes – thus becomes part of a journey back to his roots and to the discovery of his identity  which external circumstances have rendered ambiguous and complex.,2020,,85,['drama'],['GB'],,,,,4.317,5.2"
"ts237751,Gameboys,SHOW,Teenage streamer Cairo is caught off guard when he receives a video call from a new online rival called Gavreel. He is even more surprised when the handsome stranger asks him out.,,,,,,,,,,,"
"ts267956,Ethos,SHOW,A group of unique characters from dramatically different socio-cultural backgrounds meeting in startling circumstances in the vibrant and colorful city of Istanbul  some by chance and some by force of will.,2020,,48,['drama'],['TR'],1.0,,,,10.718,7.9"
"tm853396,Dragonheart: Vengeance,MOVIE,Lukas  a young farmer whose family is killed by savage raiders in the countryside  sets out on an epic quest for revenge  forming an unlikely trio with a majestic dragon and a swashbuckling  sword-fighting mercenary  Darius.,2020,PG-13,97,['fantasy'  'european'],['US'],,,,,48.702,7.0"
"ts221293,The King: Eternal Monarch,SHOW,When a gateway opens to a parallel universe in modern-day Korea  a king must step into another world in search of answers to a long-unanswered mystery.,2020,,71,['scifi'],['KR'],1.0,,,,47.02,8.5"
"ts225460,Freud,SHOW,Eager to make his name in 19th-century Vienna  a hungry young Sigmund Freud joins a psychic and an inspector to solve a string of bloody mysteries.,2020,TV-MA,54,['drama'],['DE'  'AT'],1.0,,,,25.019,7.5"
"tm467579,The Last Summer,MOVIE,Standing on the precipice of adulthood  a group of friends navigate new relationships  while reexamining others  during their final summer before college.,2019,,109,['comedy'  'romance'],['US'],,,,,16.247,6.0"
"tm475836,The Lonely Island Presents: The Unauthorized Bash Brothers Experience,MOVIE,The Lonely Island spoofs Jose Canseco and Mark McGwire in this visual rap album set in the Bash Brothers' 1980s heyday.,2019,,30,['comedy'],['US'],,tt10376068,,,7.367,6.2"
"tm977464,Youth v Gov,MOVIE,How can we bring accountability over the climate crisis? This inspiring story of youth activism documents 21 activists from across the nation as they file a groundbreaking lawsuit against the United States. The case reveals evidence that the government has endangered their constitutional rights to life  liberty  and property by acting over six decades to create the climate crisis. Youth v Gov  produced by the company behind acclaimed films such as The Ivory Game and Step  shows the power of young people to lead.,2020,,110,['documentation'],[],,tt13192640,6.9,18.0,4.108,"
"tm462903,Backdraft 2,MOVIE,""Years after the original Backdraft  Sean  son of the late Steve """"Bull"""" McCaffrey  is assigned to investigate a deadly fire only to realize it is something much more sinister."",2019,R,102,['drama'],['US'  'BE'],,,,,19.812,6.6"
"ts219049,Til Death Do Us Part,SHOW,Based on the speculative short stories of MirrorFiction  this sci-fi thriller anthology plunges headlong into our deepest desires -- and darkest fears.,2019,TV-MA,44,['scifi'  'documentation'],['TW'],1.0,,,,1.074,9.0"
"ts85480,Carole & Tuesday,SHOW,Fifty years have passed since mankind began migrating to the new frontier: Mars. It's an age where most culture is produced by AI  and people are content to be passive consumers.  There's a girl. Scrapping a living in the metropolis of Alba City  she's working part time while trying to become a musician. She's always felt like something is missing. Her name is Carole.There's a girl. Born to a wealthy family in the provincial town of Herschel City  she dreams of becoming a musician  but nobody around her understands. She feels like the loneliest person in the world. Her name is Tuesday.,,,,,,,,,,,"
"ts221365,Criminal: Spain,SHOW,Psychological games abound between detectives and suspects in a tense interrogation room  where the search for answers sometimes comes at a moral cost.,2019,TV-MA,40,['crime'],['ES'],1.0,,,,6.23,6.6"
"ts225860,Bloodride,SHOW,The doomed passengers aboard a spectral bus head toward a gruesome  unknown destination in this deliciously macabre horror anthology series.,2020,TV-MA,31,['scifi'],['NO'],1.0,,,,11.289,7.0"
"ts236033,#blackAF,SHOW,A father takes an irreverent and honest approach to parenting and relationships.,2020,TV-MA,35,['comedy'],['US'],1.0,,,,4.274,7.1"
"tm371882,Ne Zha,MOVIE,Nezha gets into trouble and implicates his parents  who get punished by the heavens along with him. He bravely steps up and admits his fault  which touches the heavens  and his effort comes to fruition. The family of three finally reunites in the end.,2019,PG-13,110,['fantasy'],['CN'],,tt7843530,,,6.397,8.0"
"tm858001,Only,MOVIE,After a comet releases a mysterious virus that begins to kill all of the women in the world  a young couple's relationship is severely tested. They hide out (from both the illness and the savages who hunt the remaining women) in their over-sterilized apartment. Ultimately the duo escapes their self-imposed quarantine to head to the wilderness.,2020,R,98,['romance'  'horror'  'thriller'  'drama'  'action'  'family'],['US'],,,,,5.929,5.5"
"tm885860,Hannah Gadsby: Douglas,MOVIE,Hannah Gadsby returns for her second special and digs deep into the complexities of popularity  identity  and her most unusual dog park encounter.,2020,,72,['comedy'],['AU'],,,,,3.917,7.5"
