"tm140334,Sniper: Legacy,MOVIE,After several military leaders are assassinated  Brandon hears his father was one of the people killed. As he hunts the killers  Brandon learns his father is not dead  and he is being used as bait.,2014,R,94,['thriller'  'european'],['US'],,,,,12.202,6.0"
"ts121189,Raja  Rasoi Aur Anya Kahaniyaan,SHOW,Explore the history and flavors of regional Indian cuisine  from traditional Kashmiri feasts to the vegetarian dishes of Gujarat.,2014,,29,['history'  'documentation'],['IN'],3.0,tt6953924,9.0,327.0,0.77,"
"tm137379,Silent,MOVIE,A duo of street performers learns how sound and picture work together to create amazing cinema experiences.,2014,,3,['animation'  'family'  'action'],['US'],,,,,2.956,7.0"
"tm587320,El Mago Pop,MOVIE,Antonio Diaz is a young and talented magician who uses magic to test the six degrees of separation theory  meeting celebrities and anonymous people along the way.,2013,,44,['reality'  'european'],['ES'],,tt3355166,6.8,21.0,,"
"tm458034,BoJack Horseman Christmas Special,MOVIE,""It's Christmas  and BoJack wants nothing to do with it. Then Todd shows up with a giant candy cane and an old """"Horsin' Around"""" Christmas episode."",2014,,25,[],['US'],,,,,1.566,7.1"
"tm175753,Chashme Baddoor,MOVIE,Siddharth  Omi  and Jai are close friends and roommates who are studying at Delhi University. Siddharth has completed M.A in Economics and is preparing for Ph.D. Siddharth is very studious and spends most of his time with books whereas Omi and Jai are busy in chasing girls  watching movies or dramas,,,,,,,,,,,"
"tm162259,Mars at Sunrise,MOVIE,A conflict between a Palestinian artist and an Israeli soldier is told in a surrealist style.,2014,,75,['drama'],['US'],,tt2714424,7.8,43.0,1.215,"
"tm132675,100 Things to Do Before High School,MOVIE,With the pressures of high school in their near future  CJ and her two best friends decide to embark on a series of middle school adventures while they can still take risks and have fun.,2014,,44,[],['US'],,,,,0.0094417458789051,"
"tm250364,Chhota Bheem in the Incan Adventure,MOVIE,A huge bird swoops down and kidnaps Princess Indumati. The army's scoured the whole area and the neighboring kingdoms but there's no trace of Princess Indumati. The only thing Bheem finds was strange bird-feathers from the land of Incas. Bheem and team starts searching in the forests of Mexico where Dholu-Bholu fall off into a river. Bheem and others jump in to save them but are soon carried off by the rivers currents to the shores of a desolate valley. The valley is covered with heaps and heaps of ashes all around one such mound lie near the princess bangles. The sun rises and the mounds of ashes takes the shape of humans. The Incas where they meet Princess Indumati.,2013,G,64,['animation'  'fantasy'],['XX'],,tt4171600,7.4,31.0,0.6,"
"tm163066,Xenos,MOVIE,In 2010  Abu Eyad and other young Palestinian men from the Ain el-Helweh refugee camp in Lebanon travelled with smugglers through Syria and Turkey into Greece. Like so many other migrants  they came looking for a way into Europe but found themselves trapped in a country undergoing economic  political  and social collapse.,2013,,12,['documentation'],['GB'],,tt3289618,7.8,,1.4,5.0"
"tm323262,Seven Souls in the Skull Castle,MOVIE,After the demise of warlord Nobunaga ODA  Japan was about to be unified by Hideyoshi TOYOTOMI. However  there was one man in Kanto region that was defiant to it. That man  who named himself TenmaOh (Mirai MORIYAMA) and leads the KANTO DOKURO-TO  an armed group hiding in the pitch-black DOKURO-JO (skull castle)  once worked for NOBUNAGA. Sutenosuke (Shun OGURI) happens to rescue a woman who has been chased by the KANTO DOKURO-TO  which was headed by the bloodthirsty madman TenmaOh.,2013,,179,['drama'  'action'  'romance'],['JP'],,tt15133818,7.3,47.0,1.699,"
"ts20238,Boss & Me,SHOW,Based off Gu Man’s very popular internet novel  the story tells of a kind hearted young girl who works at a big conglomerate. However one of her weaknesses is eating  she loves to eat  and so upon discovering this her boss decides to intentionally fatten her up,,,,,,,,,,,"
"tm681614,Grandmother's Farm,MOVIE,,2013,,71,['comedy'  'horror'],[],,tt10033686,2.9,74.0,,"
"tm1194608,Motu Patlu: Deep Sea Adventure,MOVIE,Friends Motu and Patlu get more maritime excitement than anticipated when the sinking of their ship sends them on a journey through the ocean floor!,2014,,75,['comedy'  'action'  'family'],['IN'],,,,,0.6,"
"tm577690,A Place in the Stars,MOVIE,A young lawyer gets a case he believes will make him rich. In the process he encounters dangerous men willing to kill to protect a fake and adulterated medical drugs trade worth billions in Nigeria. The outcome helps him come to terms with his life and resolve the clash of values he has had with his father all along.,2014,,112,['drama'  'thriller'],['NG'],,tt3884826,6.2,19.0,1.264,"
"tm1036195,Condom Lead,MOVIE,A dream of the hope for intimacy and love in a brutal  divisive world.,2013,,15,['drama'],['PS'],,,,,0.643,"
"ts271005,幸福料理,SHOW,,2014,TV-14,44,[],[],1.0,,,,0.6,"
"ts32752,Two Fathers,SHOW,Seven years ago  two men were notified that the women they both dated had disappeared after giving birth to a baby girl. Not knowing who the father was  the two bachelors decided to raise the baby together. Tang Xiang Xi  the smooth-talking lawyer  and Wen Zhen Hua  the sensitive florist  and the young Tang Wen Di make up a non-traditional family. Their unique living arrangement attracts the attention of the girl's pigheaded teacher and their reclusive next door neighbor.,2013,TV-14,44,['comedy'  'drama'],['TW'],1.0,tt6707142,8.0,54.0,3.73,"
"ts144527,World at Your Feet,SHOW,A group of struggling individuals are united by a love of soccer,,,,,,,,,,,"
"tm250247,Chhota Bheem & Krishna vs Zimbara,MOVIE,Chhota Bheem Aur Krishna vs Zimbara is an Indian animated movie featuring Bheem  the star of the Chhota Bheem series. It is the 19th movie of the series. Running Time - 65 mins.,2013,G,64,['animation'],[],,tt6417984,8.6,13.0,2.025,"
"ts107543,Mystic Whispers,SHOW,After a car accident enables a young woman to hear mysterious sounds  she meets a mortician. Together  they listen to ghosts and try to help them.,2014,TV-14,26,['comedy'  'romance'],['SG'],1.0,tt8834748,6.9,17.0,,"
"tm177376,Todd Glass Talks About Stuff,MOVIE,""In Todd Glass Talks About Stuff  Todd Glass talks about...stuff  covering infomercials  ranting about eating slowly  and bullying those who bullied him for being afraid of the dark. He opens up about his dyslexia  which caused him to say """"domestitated."""" Some of Todd's best stories include going to a restaurant with a health rating of """"D"""" with """"elicious"""" scrawled after it  wanting to suck the goodness out of his dog  and discovering the things that poor people and rich people do."",2013,,46,['comedy'],['US'],,,,,1.4,"
"tm610571,Diamonds in the Sky,MOVIE,Survival of a 'truly independent' filmmaker far away from the industry.,2014,,132,['drama'],['IN'],,tt2338287,7.4,10.0,,"
"tm528044,Chhota Bheem Neeli Pahaadi,MOVIE,The kids are excited  as they have all planned a trip to the Neeli Pahadi right on the borders of Dholakpur. The Neeli Pahadi has always been an uneasy reality of Dholakpur with rumours of ghostly inhabitants and a mysterious past which goes back right to the days when the kingdom of Dholakpur was established.,2013,G,63,['animation'],[],,tt6442694,8.5,9.0,,"
"tm175364,Chhota Bheem Aur Hanuman,MOVIE,The grouchy Makhichoos  whoe hates Diwali  is digging furiously in the Dholakpur forest searching for a demon.  Soon the demon emerges from the roots of a tree.  Both the evil witch and Makhichoos plan to build a new kingdom on the eve of Diwali and teach Bheem a lesson.  While Bheem and his friends are preparing for the celebrations  Chhota Hanuman also comes there to be a part of the festival.  But something worse happens,,,,,,,,,,,"
"tm529733,Chhota Bheem and the ShiNobi Secret,MOVIE,Prof. Dhoomketu is trying to build a new machine based on how a volcano works. Dholu and Bholu mess around which gives Kalia a new 'smoking' hairdo. As Bheem and Chutki try to restore the machine  Indumati arrives in with Bheem's Samurai friend Sam. Jack relates that his entire clan in Iga  Japan is under threat from an unseen enemy. The youngsters of his village are disappearing at an alarming rate and efforts to trace them are coming to naught. Further  their king has been threatened by the cruel Emperor Hidoi Shin. The samurai of Sam's village are loyal to the king and lead his army but the disappearance of the good fighters has now put them at a disadvantage. Sam's grandfather talks about the lurking of a secret shadow but time is running out. Bheem and gang travel to Japan with Jack to save his clan and solve the Shinobi secret.,2013,G,63,['animation'],['IN'],,tt6417830,8.6,6.0,,"
"ts261583,Ojo's in d' House,SHOW,A sitcom about the Ojo family  a newly-rich family that moves into a classy Lagos neighborhood. Each episode revolves around the hilarious antics of Mrs. Ojo and her obsession with keeping up appearances to be accepted by those of the upper-class social standing.,2013,,24,['comedy'],['NG'],1.0,tt12960266,6.1,11.0,,"
"tm481846,Chhota Bheem Dus pe Dus,MOVIE,In Kerala  Bheem suffers a humiliating defeat- not only is a rare temple stone is stolen under his watch  but the thief easily defeats Bheem and slips away.,2014,G,62,['animation'],['XX'],,tt6417940,5.1,23.0,,"
"tm528043,Chhota Bheem the Crown of Valhalla,MOVIE,Bheem and his friends are returning from the kingdom of Raunakpur when lightning strikes and they are caught in a sea-storm. Their ship 'Dholakpur Queen' is tossed and turned on the waves and captain Samudra Sen tries his best to keep it afloat. When the storm abates  Samudra Sen is stunned and says 'Valhalla'.,2013,,64,['animation'],[],,tt6442766,8.1,14.0,,"
"ts42069,The Crown,SHOW,The gripping  decades-spanning inside story of Her Majesty Queen Elizabeth II and the Prime Ministers who shaped Britain's post-war destiny. ,,,,,,,,,,,"
"ts38304,Servant of the People,SHOW,Modest and humble teacher Vasily is caught on camera raging over the miserable situation in his country. When a pupil posts the video on Youtube  it becomes a viral sensation. Everybody loves Vasily’s outrage and people start gathering money for a presidential campaign. Which he wins! Servant of the People follows Vasily’s new life as president,,,,,,,,,,,"
"ts36015,Into the Badlands,SHOW,In a land controlled by feudal barons  a great warrior and a young boy embark on a journey across a dangerous land to find enlightenment. ,,,,,,,,,,,"
"ts21986,Good Witch,SHOW,Cassie Nightingale  Middleton’s favorite enchantress  and her young-teenage daughter Grace  who shares that same special intuition as her mom  welcome Dr. Sam Radford and his son to town. When the New York transplants move in next to the Grey House  they are immediately spellbound by the mother-daughter duo next door  but Sam and Cassie quickly find they may not see eye to eye. With her signature charm  Cassie attempts to bring everyone together  ensuring all of Middleton is in for new changes  big surprises and  of course  a little bit of magic!,,,,,,,,,,,"
"tm235227,Bill Hicks: Reflections,MOVIE,Comedy Dynamics sits down with Bill Hicks’ brother  Steve  who tells old stories  squashes old rumors and reveals the brother and son behind the late comedian. Told amidst old and rare footage  it’s a must watch for any fan.,2015,,34,['documentation'],['US'],,,,,0.901,6.7"
"tm215638,Boyka: Undisputed IV,MOVIE,In the fourth installment of the fighting franchise  Boyka is shooting for the big leagues when an accidental death in the ring makes him question everything he stands for. When he finds out the wife of the man he accidentally killed is in trouble  Boyka offers to fight in a series of impossible battles to free her from a life of servitude.,2016,R,87,['drama'  'european'],['BG'],,,,,207.147,7.0"
"ts119087,Sunny Bunnies,SHOW,Furry little bunnies hop through wild adventures as they find solutions  fun and sometimes mischief wherever there is light.,2015,TV-Y,3,['animation'  'family'],['BY'],4.0,tt7264084,6.6,95.0,2.575,"
"tm240007,Sniper: Ghost Shooter,MOVIE,Elite snipers Brandon Beckett and Richard Miller are tasked with protecting a gas pipeline from terrorists looking to make a statement. When battles with the enemy lead to snipers being killed by a ghost shooter who knows their exact location  tensions boil as a security breach is suspected. Is there someone working with the enemy on the inside? Is the mission a front for other activity? Is the Colonel pulling the strings?,2016,R,100,['drama'],['US'],,,,,24.896,6.6"
"tm219173,Term Life,MOVIE,If Nick Barrow can stay alive for 21 days  he'll die happy. Everyone Nick knows wants him dead,,,,,,,,,,,"
"tm335263,Kathleen Madigan: Bothering Jesus,MOVIE,Kathleen Madigan's stand up special.,2016,R,71,['comedy'],['XX'],,,,,1.734,6.6"
"tm253080,Rocco,MOVIE,Rocco Siffredi is to pornography what Mike Tyson is to boxing or Mick Jagger is to rock’n’roll: a living legend. His mother wanted him to be a priest,,,,,,,,,,,"
"ts35359,Heidi,SHOW,Knee-high to a grasshopper  Heidi  a young orphan brunette with curly hair and the face of an angel  is brought by her aunt to the Swiss Alps to live with her grand-father  a silent and solitary old man. Taking up the challenges of her new existence  she will display all her strength and natural resources to find her rightful place in a sometimes harsh and unfriendly environment. Whether in the magnificent mountain settings with Peter  the goatherd or shut away in a big mansion in Frankfurt with Clara  a disabled girl confined to a wheelchair  Heidi will learn the priceless value of friendship and mutual help. Like a ray of sunshine  Heidi lights up and soothes the hearts of people and animals around her  inspiring them with her enthusiastic  generous and wonderful zest for life. The essence of a positive heroine  Heidi goes through life in the present without ever losing her innocence and her free-spirited manners.,2015,TV-Y,27,['drama'  'family'  'animation'  'european'],['DE'  'AU'  'FR'],2.0,tt4346362,7.2,234.0,13.453,"
"tm229140,Anthony Jeselnik: Thoughts and Prayers,MOVIE,There's no subject too dark as the comedian skewers taboos and riffs on national tragedies before pulling back the curtain on his provocative style.,2015,,59,['comedy'],['US'],,,,,6.22,7.4"
"tm266628,LEGO Jurassic World: The Indominus Escape,MOVIE,The scientists of Jurassic World create a captivating and terrifying new creature that loves hot dogs. But what happens when the hot dogs run out?,2016,G,24,['family'  'animation'  'comedy'],['US'],,,,,13.027,5.7"
"ts41294,Mossad 101,SHOW,Cadets from every level of Israeli society undergo intense training to join their country's elite  highly classified intelligence service  the Mossad.,,,,,,,,,,,"
"ts53076,El Chema,SHOW,Inspired by true events  This is the story of the most notorious drug kingpin the world had ever seen. A man known as El Chapo  the biggest international drug lord in history. The most important and influential man  in the history of Narcos. He changed the game with his spectacular escapes and innovative smuggling techniques.,2016,TV-MA,44,['drama'  'action'  'crime'],['US'],1.0,tt5730624,6.9,303.0,103.284,"
"tm323616,The Visit,MOVIE,Two couples living together in the same building  but with completely different lifestyles  find themselves bearing secrets and shocking revelations which sets them on course for something they never bargained for.,2015,,130,['comedy'  'romance'  'thriller'],[],,tt15119398,,,1.048,6.0"
"tm225275,Riot,MOVIE,Copper Jack Stone purposefully orchestrates a bank robbery in order to be thrown into prison with the notorious Russian kingpin Balam. Balam is more than just a mob criminal,,,,,,,,,,,"
"ts31593,Pororo the Little Penguin,SHOW,Pororo the Little Penguin is a computer-generated animated cartoon series created by Iconix Entertainment  SK Broadband  Ocon and EBS with the North Korean company Samchŏlli in Kaesŏng. Production began in 2002 and the program began airing in South Korea on EBS in 2003.,,,,,,,,,,,"
"tm243849,Extremis,MOVIE,A purely observational non-fiction film that takes viewers into the ethically murky world of end-of-life decision making in a public hospital.,2016,,24,['documentation'],['US'],,,,,5.349,7.1"
"tm238829,Open Season: Scared Silly,MOVIE,The humans and animals believe a werewolf is on the loose  and former hunter Shaw uses the opportunity to re-open the season. Boog  Elliot  and Mr. Weenie have to face their fears and find the werewolf to get the season closed permanently.,2015,PG,85,['animation'],['US'  'CA'],,,,,25.774,5.9"
"tm199987,Ralphie May: Unruly,MOVIE,Very little is off-limits in comedian Ralphie May’s very first Netflix original stand-up comedy special  Unruly. Filmed live in front of a raucous  fist-pumping crowd at Cobb Energy Performing Arts Centre in Atlanta  May unleashes his hilariously raunchy  no-holds-barred perspective on everything from airline travel and the news media  to Chick-fil-A and everybody being a little racist when they drive.,2015,,83,['comedy'],['US'],,,,,3.016,4.3"
"tm252245,The White Helmets,MOVIE,As daily airstrikes pound civilian targets in Syria  a group of indomitable first responders risk their lives to rescue victims from the rubble.,2016,,40,['war'  'documentation'],['SY'  'GB'],,,,,6.399,7.4"
"ts82582,The Truth Seekers,SHOW,A veteran cop forms an agency dedicated to solving cold cases  including those related to the team members' own painful and mysterious pasts.,2016,TV-MA,44,['drama'  'action'],['SG'],1.0,tt7131694,7.1,16.0,2.561,"
"tm526163,Dinosaur World,MOVIE,Scientist Khojwala finds it difficult to nurture a baby dinosaur. He  with the help of Chotta Bheem and his gang  decides to travel back in time to return the animal to its world.,2015,,65,['animation'  'comedy'  'drama'],['IN'],,tt6536576,,,,"
"ts87465,Witch Hunt: A Century of Murder,SHOW,Four hundred years ago  hundreds of innocent people were killed as an obsession to stamp out Satanism swept the British Isles. Dr Suzannah Lipscomb investigates the events of this dark period in our history.,2015,TV-14,46,['crime'  'history'  'fantasy'  'drama'  'european'],['GB'],1.0,tt6474054,7.2,319.0,0.862,"
"ts107658,Mind Game,SHOW,With the help of a cop  a psychiatrist and a woman who can foretell the future  a brilliant paralegal works to solve an array of perplexing mysteries.,2015,TV-14,44,['drama'  'action'  'crime'],['JP'  'US'],1.0,tt8879588,7.5,12.0,,"
"tm228657,Cosmos Laundromat,MOVIE,On a desolate island  a suicidal sheep named Franck meets his fate…in the form of a quirky salesman named Victor  who offers him the gift of a lifetime. The gift is many lifetimes  actually  in many different worlds – each lasting just a few minutes. In the sequel to the pilot  Franck will find a new reason to live…in the form of a bewitching female adventurer named Tara  who awakens his long-lost lust for life. But can Franck keep up with her?,2015,,12,['fantasy'],['NL'],,,,,2.931,6.6"
"tm218683,The Massively Mixed-Up Middle School Mystery,MOVIE,When the ultimate prank sends their principal under water  it's up to Everett  Alyssa and Riley to put their super detective skills to the test  catch the perp  and save their school's first dance in 40 years.,2015,,39,['comedy'],['XX'],,tt3521770,7.3,78.0,1.784,"
"tm494288,Brother Jekwu,MOVIE,Chasing wild success  a village hustler follows his cousin from Nigeria to Kenya and stumbles into the shady business affairs of a notorious overlord.,2016,,103,['comedy'  'crime'],['NG'],,tt8857316,,,0.707,"
"ts91990,The Creative Indians,SHOW,The Creative Indians is a docu-series showcasing  de-mystifying and de-constructing the lives  journeys and processes of the most impactful creative professionals and projects of India across industries like Cinema  Art  Design  Music  Fashion  Dance  Photography  Advertising and more.,2016,TV-MA,28,['documentation'],['US'],4.0,tt9583184,8.3,45.0,0.621,"
"ts83454,Have You Ever Fallen in Love  Miss Jiang?,SHOW,A new teacher finds herself in an unenviable situation after witnessing a troubling interaction between an administrator and a student.,2016,TV-14,89,['drama'],['TW'],1.0,,,,2.273,"
"tm452046,Hans Teeuwen: Echte Rancune,MOVIE,Hans Teeuwen's Real Rancour  recorded live at the Leicester Square Theatre  November 2016.,2016,,103,['comedy'],['NL'],,,,,1.4,6.3"
"ts224440,If I were an Animal,SHOW,Curious kids Emma and her big brother Tim observe different animals as they make their way through various life milestones  from birth to adulthood.,2016,TV-G,10,['documentation'],['FR'],1.0,,,,0.722,"
"ts81027,Spark,SHOW,Spark' is a mini music drama like a night concert in the summertime  centering on a man who leaks a great deal of electricity after a sudden accident and a woman he can't get away from no matter how hard he tries,2016,TV-14,13,['drama'],['KR'],5.0,tt6409112,7.0,57.0,1.214,"
"tm215265,Ave Maria,MOVIE,The silent routine of 5 Nuns living in the West Bank wilderness is disturbed when an Israeli settler family breaks down right outside the convent just as the Sabbath comes into effect.,2015,,15,['comedy'],['FR'  'DE'  'PS'],,,,,3.006,5.9"
"ts82475,The Dream Job,SHOW,Many people harbour the hope of a 'dream job'  one that pays well  offer great benefits  and with a boss who treats them like his own.,2016,TV-14,44,['drama'  'family'],['SG'],1.0,tt7131688,6.1,14.0,0.967,"
"tm554110,The CEO,MOVIE,Five top level staff of a company are selected for a retreat where the new CEO of a global company will be chosen. What starts off as cordial soon goes sour as they attempt to outdo one another to be named The CEO.,2016,PG-13,105,['drama'  'thriller'],['NG'],,tt5036924,5.7,121.0,1.482,"
"ts253685,Secret of Success,SHOW,An aspiring actor uses a magical book to transport himself inside the movies he had always dreamed of starring in -- but not without consequences.,2015,TV-14,41,['drama'],['MY'],1.0,,,,0.6,"
"tm549892,Aerials,MOVIE,Earth is invaded by Aliens from outer space. An intermarried couple living in the city of Dubai are confined to their home due to the uncertainty of the situation. Disconnected from the world outside due to the loss of communication  they explore around their cultural differences in Science in order to understand the reason behind Aliens coming to our planet,,,,,,,,,,,"
"ts285233,Unchained fate,SHOW,A young trio aims to protect the world from evil  armed with magic crystals that allow them to control time  commune with spirits  and more.,2016,TV-14,40,['scifi'],['MY'],1.0,,,,1.008,"
"tm239635,Jimmy Carr: Funny Business,MOVIE,British comedian Jimmy Carr unleashes his deadpan delivery and wickedly funny one-liners to a sold-out audience at the UK's Hammersmith Apollo.,2016,,62,[],['GB'],,,,,6.56,6.9"
"tm319354,Santa Pac's Merry Berry Day,MOVIE,﻿As Pacworlders excitedly decorate for Berry Day  Pac is saddened about missing his parents as he receives a picture ornament of them from his Aunt Spheria.  The teens reminisce of their childhood Berry Day as they enjoy Christmas eggnog.  Since Berry Day is one of the happiest days of the year  Betrayus launches a plan to get rid of the day by capturing Santa Pac and his Round Deer and to possess the gifts and Berry Day decorations. All Pac wants for Berry Day is to see his parents Sunny and Zac and is overjoyed when they arrive. But  his parents tell him they want to see the tree of life in the secret location which is forbidden.  Are these Pac’s real parents or are they a trick from Betrayus and Dr. Slimestein?  Let’s hope Berry Day can be merry after all.,2016,,44,['action'  'animation'  'comedy'],['JP'  'US'  'CA'],,,,,1.328,5.5"
"ts87884,Sons of the Caliphate,SHOW,This is a drama series about the lives of three rich  entitled  passionate and ambitious young men: Kalifah  Nuhu and Diko. Elections are fast approaching and there's a tussle for the governorship seat of the Northern Caliphate State of Kowa. Soon personal conflicts intertwine between their families in a race to crown the next Governor.,2015,TV-14,39,['drama'],['NG'],1.0,tt10202268,7.4,32.0,0.73,"
"tm456667,Black,MOVIE,A boy. Who has no identity. One day  he want to change but this is almost over.,2015,,90,['action'],[],,tt7254796,4.4,74.0,0.6,"
"tm421214,Saudi Arabia Uncovered,MOVIE,English reporter and documentarian  James Jones  in partnership with brave rebel Saudi Arabian undercover reporters  risk themselves under the laws of the land under the Committee for the Promotion of Virtue and the Prevention of Vice (CPVPV)  sometimes referred to the Islamic Religious Police. All this  in an effort to uncover the purpose and truth of the laws enforced by the immensely questioned Saudi Arabian government. You will see the side of Saudi Arabia that its government forbids from recording or viewing by their law and discover the harsh punishment for disobedience in the modern Saudi Arabia world.,2016,,51,['documentation'],['SA'],,,,,1.102,6.5"
"tm286268,#Rucker50,MOVIE,The celebratory explosion of basketball history makers  legend shakers and lawbreakers,,,,,,,,,,,"
"tm313374,The Tour,MOVIE,Miloš Knor brings a group of Czech comedians on a tour around the Czech Republic.,2016,,93,['comedy'  'european'],['CZ'],,,,,0.6,7.0"
"tm540757,Project Marathwada,MOVIE,An indebted old farmer Tukaram wants to get justice for his son who commits suicide. But when Tukaram's pleas fall on deaf ears  he is forced to take a drastic step to ensure that his voice is heard  loud and clear  by the nation.,2016,,110,['drama'],['IN'],,tt5714802,6.6,88.0,1.384,"
