"ts300399,Five Came Back: The Reference Films,SHOW,""This collection includes 12 World War II-era propaganda films — many of which are graphic and offensive — discussed in the docuseries """"Five Came Back."""""",1945,TV-MA,48,['documentation'],['US'],1.0,,,,0.6,"
"tm97793,Lock Your Girls In,MOVIE,Dr. Raafat faces challenges and difficulties in raising his three daughters  Fawzia (Sanaa Younis)  Soso (Shreihan) and Nadia (Ijlal Zaki).,1980,,230,['comedy'],['EG'],,,,,2.313,8.0"
"tm85426,The Witness Who Didn't See Anything,MOVIE,An Egyptian comedy play about an innocent  clueless and naive young man who is asked to stand as a witness on a murder trial of a belly dancer who lived downstairs from his apartment.,1976,,217,['comedy'],['EG'],,,,,2.612,7.7"
"tm188894,The School of Mischief,MOVIE,This play is about a female teacher and how she transformed 5 rebellious students into model students.,1973,,251,['comedy'],['EG'],,,,,3.381,8.5"
"tm117580,She's Gotta Have It,MOVIE,The story of Nola Darling's simultaneous sexual relationships with three different men is told by her and by her partners and other friends. All three men wanted her to commit solely to them,,,,,,,,,,,"
"tm55091,Quiet Victory: The Charlie Wedemeyer Story,MOVIE,Film that tells the story of Los Gatos (California) high school football coach Charlie Wedemeyer. At 31  onetime football pro Wedemeyer is living the American dream,,,,,,,,,,,"
"tm126791,The Married Couples,MOVIE,The story revolves around the problems of married people in (Egypt) from the economic and social aspects  where the poor young man (Masoud) falls in love with the aristocratic girl (Lina)  and marries her despite her father's refusal. The simple poor life experience with her husband  whom she loves  her father tries to pressure her by various means  including threatening to deprive her of the inheritance  but she is determined to stay with her husband  Masoud asks Lina to move with her to her father's villa in order to get out of the difficult life he lives in rented home.,1981,,194,['drama'],['EG'],,,,,1.532,9.2"
"tm186777,Sayed The Servant,MOVIE,Adel Imam plays the role of educated person who is forced to work as house servant to hide from the police.,1985,,166,['comedy'],['EG'],,,,,4.494,7.6"
"tm311264,Muqaddar Ka Faisla,MOVIE,Muqaddar ka Faisla  is the story of Pandit Krishna Kant. A poor  but extremely honest  upright  God-fearing man  who refuses to compromise on his principles.,1987,,172,['comedy'  'drama'  'family'  'action'],['IN'],,tt0239682,4.8,68.0,1.825,"
"tm132164,Bill Hicks: Sane Man,MOVIE,Sane Man was filmed before Bill recorded ‘Dangerous’  his first comedy album  and is a turning point in Hicks’ career. It was the first complete Hicks show ever filmed and Bill pulled out all the stops for the cameras. Completely focused  a newly-sober Hicks paces the stage like a wild animal riffing effortless.,1989,R,81,['comedy'],['US'],,,,,3.245,7.5"
"tm342996,Duniya,MOVIE,Mohan Kumar's diligence and honesty lands him in trouble with Balwant Singh Kalra  Jugal Kishore Ahuja  and Mr. Bhandari. Together the trio frame and imprison Mohan and make him watch helplessly as his wife is killed. Years later  Mohan Kumar is released from prison  his only goal in life is to avenge his humiliation and wrongful arrest at the hands of the trio. With the help of Dinesh Verma  he establishes himself again  and starts the process of bringing death and destruction to the trio. The trio are well aware of his presence  and decide to send one of their men  Ravi  to spy on him. Ravi falls in love with Verma's daughter  Roma  and decides to change sides to help Verma and Mohan  but Mohan will not have anything to do with Ravi  and asks him to leave. Ravi then becomes a target by the trio and their men  and has to save himself  and the only way he can redeem himself is by turning the tables over Mohan  who is none other than his own father.Duniya,1984,,170,['drama'  'action'],['IN'],,tt0301231,6.2,241.0,1.476,"
"ts63001,High Risk,SHOW,High Risk is a program aired by the CBS television network as part of its 1988 fall lineup.,,,,,,,,,,,"
"tm411457,Pyar Ke Do Pal,MOVIE,In order to assist her close friend  Rajni Thakur  Geeta Choudhary  has an abortion in her name  so that Rajni can get married. When her secret gets leaked out  Geeta's husband  Ashok  blames her  accuses her of being unfaithful  and drives her out of his house. They have twins  Sunil and Anil  and each parent is allowed custody of one child. The children meet each other at Scout camp  and decide to re-unite their parents  without realizing that they are exposing not only them  but also each other  to danger and death.,1986,,153,['drama'  'action'],['IN'],,tt0358053,6.1,65.0,1.094,"
"ts251477,My First Errand,SHOW,“Hajimete no Otsukai” (First Errand) is a Japanese TV show that follows small children as they carry out errands for their parents.,1991,TV-G,19,['reality'],['JP'],12.0,,,,12.155,7.0"
"ts8570,Barney & Friends,SHOW,Barney & Friends is an American children's television series aimed at children from ages 2 to 5. The series  which first aired on April 6  1992  features the title character Barney  a purple anthropomorphic Tyrannosaurus rex who conveys educational messages through songs and small dance routines with a friendly  optimistic attitude.,,,,,,,,,,,"
"ts21581,Girlfriends,SHOW,Girlfriends is an American comedy-drama sitcom that premiered on September 11  2000  on UPN and aired on UPN's successor network  The CW  before being cancelled in 2008. The final episode aired on February 11  2008.,,,,,,,,,,,"
"tm7135,Bill Hicks: One Night Stand,MOVIE,Bill Hicks shows us his view on smoking  smoking pot  drinking  sex  advertisement and music. It's not a view you hear very often.,1991,NC-17,30,['comedy'],['US'],,,,,1.08,7.5"
"tm128073,Bill Hicks: Relentless,MOVIE,Bill Hicks tells us how he feels about non-smokers  blow-jobs  religion  war and peace  and drugs and music.,1992,,61,['comedy'],['GB'],,,,,4.105,7.9"
"ts22039,H,SHOW,H is a French sitcom with seventy-one  22-minute episodes. The series was created by Kader Aoun  Xavier Matthieu and Éric Judor  and produced by Phillippe Berthe  Édouard Molinaro  Jean-Luc Moreau and Charles Némès. It ran from 24 October 1998 to 20 April 2002 on Canal+. In Canada  it is shown weekly on TV5.,,,,,,,,,,,"
"ts224786,Escalona,SHOW,The improbable real life of Rafael Escalona  who had no music education and became Colombia's king of vallenato music  chronicling everyday life.,1991,TV-MA,44,['drama'],['CO'],1.0,,,,9.244,7.7"
"tm52083,West Beirut,MOVIE,In April  1975  civil war breaks out,,,,,,,,,,,"
"tm8687,Sam Kinison: Family Entertainment Hour,MOVIE,Get ready to scream with laughter! Sam Kinison's primal scream will echo down through the comedy hall of fame summing up so much of modernity's horror and stupidity. This concert was taped at the Wiltern Theatre where Sam was joined with the Randy Hansen Band and a salacious slew of sinuous sirens  including his wife Malika. Join Sam Kinison and guests for a concert guaranteed to make you laugh 'til you cry for more - there's something for every member of the family - Sam Kinison style!,1991,,49,['comedy'],['US'],,,,,2.545,6.0"
"tm314602,Dushmani,MOVIE,In order to settle personal scores,,,,,,,,,,,"
"tm210754,Have You Ever Seen Fireflies? - Theatre Play,MOVIE,Yılmaz Erdoğan's lauded stage play traces the life of wunderkind Gülseren as she navigates social and political change.,1999,,118,['drama'  'comedy'],['TR'],,,,,1.844,7.5"
"tm255589,One Last Shot,MOVIE,In this low-budget short film  two best buddies meet up for a night of booze-fueled fun before one of them moves to Vancouver.,1998,,30,[],[],,,,,1.439,5.3"
"ts11,Downton Abbey,SHOW,A chronicle of the lives of the aristocratic Crawley family and their servants in the post-Edwardian era—with great events in history having an effect on their lives and on the British social hierarchy.,,,,,,,,,,,"
"tm997728,Blade Runner: The Final Cut,MOVIE,Visually spectacular  intensely action-packed and powerfully prophetic since its debut  Blade Runner returns in Ridley Scott's definitive Final Cut  including extended scenes and never-before-seen special effects. In a signature role as 21st-century detective Rick Deckard  Harrison Ford brings his masculine-yet-vulnerable presence to this stylish noir thriller. In a future of high-tech possibility soured by urban and social decay  Deckard hunts for fugitive  murderous replicants - and is drawn to a mystery woman whose secrets may undermine his soul. This incredible version features the definitive Final Cut of Ridley Scott's legendary Sci-Fi classic.,2007,R,117,['action'  'thriller'  'scifi'],['US'],,,,,0.055091,9.0"
"tm195620,Apocalypse Now Redux,MOVIE,Apocalypse Now Redux is a 2001 extended version of Francis Ford Coppola's epic war film Apocalypse Now  which was originally released in 1979. Coppola  along with editor/long-time collaborator Walter Murch  added 49 minutes of scenes that had been cut out of the original film. It represents a significant re-edit of the original version.,2001,R,196,['drama'  'war'  'thriller'  'horror'],['US'],,,,,4.147.341,9.8"
"tm76428,Jackass 2.5,MOVIE,The crew have now set off to finish what as left over from Jackass 2.0  and in this version they have Wee Man use a 'pee' gun on themselves  having a mini motor bike fracas in the grocery mall  a sperm test  a portly crew member disguised as King Kong  as well as include three episodes of their hilarious adventures in India.,2007,,64,['documentation'  'comedy'],['US'],,,,,20.424,6.1"
"ts30356,Octonauts,SHOW,The Octonauts is a British children's television series  produced by Silvergate Media for the BBC channel Cbeebies. The series is animated in Ireland by Brown Bag Films but uses British voice actors. The TV series is based on American-Canadian children's books written by Vicki Wong and Michael C. Murphy of Meomi Design Inc.,,,,,,,,,,,"
"ts26322,Toradora!,SHOW,Ryūji Takasu is a gentle high school student with a love for housework,,,,,,,,,,,"
"ts98340,Metallica: Some Kind of Monster,SHOW,This collection includes the acclaimed rock documentary about Metallica  plus a film checking in with the still-thriving group 10 years later.,2004,TV-MA,84,['western'],['US'  'CA'],1.0,tt6954486,,,0.6,"
"tm78189,The Contractor,MOVIE,Former CIA Operative  James Dial is coaxed back into action to kill a terrorist in London  but it all goes wrong and he is forced into hiding  where he meets and befriends a 12 year old girl.,2007,R,105,['thriller'  'european'],['BG'  'GB'  'US'],,,,,12.99,5.6"
"ts56549,Scare Tactics,SHOW,Scare Tactics is a hidden camera/comedy television show  produced by Kevin Healey and Scott Hallock. Its first two seasons aired from April 2003 to December 2004. After a hiatus  the show returned for a third season  beginning July 9  2008. The first season of the show was hosted by Shannen Doherty. Stephen Baldwin took her place in the middle of the second season. Since the beginning of the third season  the show has been hosted by Tracy Morgan. The fourth season began on October 6  2009.,,,,,,,,,,,"
"ts20398,Kath & Kim,SHOW,""Kath & Kim is a character-driven Australian television situation comedy series. The series was created by  and is written by Jane Turner and Gina Riley who play the title characters: a suburban mother and daughter with a dysfunctional relationship. The series main characters consist of Kath Day-Knight  a cheerful 50-year-old woman  her self-indulgent daughter Kim Craig  Kath's boyfriend and second husband  the metrosexual Kel Knight  as well as Kim's estranged husband Brett Craig and her lonely  overweight """"second best friend"""" Sharon Strzelecki. The series is set in the fictional suburb of Fountain Lakes in Melbourne. It is primarily filmed in Patterson Lakes."",,,,,,,,,,,"
"ts21421,Pocoyo,SHOW,Pocoyo is a Spanish pre-school animated television series created by Guillermo García Carsí  Luis Gallego and David Cantolla  and is a co-production between Spanish producer Zinkia Entertainment  Cosgrove-Hall Films and Granada International. Two series have been produced  each consisting of 52 seven-minute episodes. English actor and comedian Stephen Fry narrates the English-language version and José María del Río narrates the Castilian Spanish version.,,,,,,,,,,,"
"tm186461,No Direction Home: Bob Dylan,MOVIE,""A chronicle of Bob Dylan's strange evolution between 1961 and 1966 from folk singer to protest singer to """"voice of a generation"""" to rock star."",2005,G,208,['music'  'documentation'],['GB'  'US'  'JP'],,,,,8.676,7.7"
"tm83786,Like Stars on Earth,MOVIE,Ishaan Awasthi is an eight-year-old whose world is filled with wonders that no one else seems to appreciate. Colours  fish  dogs  and kites don't seem important to the adults  who are much more interested in things like homework  marks  and neatness. Ishaan cannot seem to get anything right in class,,,,,,,,,,,"
"ts20544,Ouran High School Host Club,SHOW,Ouran High is a school for the extremely wealthy or  in Haruhi's case  the extremely talented. But no amount of talent will help when Haruhi accidentally drops an eight million yen vase in a music room. The vase was the property of Ouran High School Host Club  a group of attractive young men who  for a fee  provide their time and affections for their lovesick clientele: the female students. Fascinated by this strange new specimen  a poor and clumsy commoner  they force Haruhi to work for them until the debt is repaid,,,,,,,,,,,"
"ts40702,The Ultimatum,SHOW,The Ultimatum is a Singaporean Chinese drama which was telecasted on Singapore's free-to-air channel  MediaCorp Channel 8. It made its debut on 27 May 2009 and ended on the date 7 July 2009. This drama serial consists of 30 episodes  and was screened on every weekday night at 9:00 pm.,,,,,,,,,,,"
"ts30288,Mobile Suit Gundam Unicorn,SHOW,The series begins in U.C. 0001  at the very beginning of human space colonization  when a space colony called Laplace is destroyed during a ceremony hosted by the Federation's Prime Minister ushering in the Universal Century dating system. The main story takes place in UC 0096  sixteen years after the end of the One Year War  three years after the events of Mobile Suit Gundam: Char's Counterattack  and 27 years before Mobile Suit Gundam F91.,,,,,,,,,,,"
"ts21967,Johnny Test,SHOW,Young Johnny is gung-ho and full of courage. Johnny's brainiac twin sisters  Susan and Mary  use Johnny as their guinea pig for their outrageous scientific experiments. If they can dream it up  Johnny will do it,,,,,,,,,,,"
"ts17028,Dinosaur King,SHOW,Dinosaur King is a card-based arcade game from Sega that uses the same gameplay mechanics from Mushiking but uses super-powered dinosaurs instead of beetles. The game was revealed in JAMMA 2005 and is available in Japanese and English versions. A Nintendo DS version has also been released in North America.,,,,,,,,,,,"
"ts3666,Den-noh Coil,SHOW,Dennō Coil  Coil — A Circle of Children  is a Japanese science fiction anime television series depicting a near future where semi-immersive augmented reality technology has just begun to enter the mainstream. The series takes place in the fictional city of Daikoku  a hotbed of AR development with an emerging city-wide virtual infrastructure. It follows a group of children as they use AR glasses to unravel the mysteries of the half real  half Internet city  using a variety of illegal software tools  techniques  and virtual pets to manipulate the digital landscape.,,,,,,,,,,,"
"tm31290,Population 436,MOVIE,A census-taker is sent to investigate why a certain small town has had the same population -- 436 residents -- for the last 100 years.,2006,R,88,['horror'  'thriller'],['CA'],,,,,6.915,5.8"
"tm80059,Naruto Shippuden the Movie,MOVIE,Demons that once almost destroyed the world  are revived by someone. To prevent the world from being destroyed  the demon has to be sealed and the only one who can do it is the shrine maiden Shion from the country of demons  who has two powers,,,,,,,,,,,"
"tm53999,Open Season 2,MOVIE,After falling head over hooves in love with Giselle  Elliot's road to the altar takes a slight detour when Mr. Weenie is kidnapped by a group of pampered pets determined to return him to his owners.,2008,PG,76,['comedy'],['US'],,,,,18.986,5.8"
"ts72322,The Mafia Dolls,SHOW,""Las Muñecas De La Mafia is a 2009 Colombian telenovela produced by BE-TV and broadcast by Caracol TV. It's based on Juan Camilo Ferrand and Andres Lopez's book """"Las Fantásticas"""". They also wrote the scripts for the television series. The telenovela will debut soon on the Telefutura Network. Series debuted on May 3  2010 after the Vecinos finale. The show ended July 2010 in the U.S."",,,,,,,,,,,"
"ts52849,Horrid Henry,SHOW,Horrid Henry is a British animated television series based on the book series by Francesca Simon produced by One Explosion Studios and Nelvana Limited  broadcast from late 2006 on Children's ITV in the UK and it will air on Cartoon Network Pakistan and Cartoon Network India on 2013 from 6am until 6:30am. The animation style differs from the Tony Ross illustrations in the books. Series Producer of the series is Lucinda Whiteley  Animation Director is Dave Unwin. The series has been sold to more than a dozen countries including France  Germany  South Africa  South Korea  and the Philippines.,,,,,,,,,,,"
"ts14102,Bo on the Go!,SHOW,""Bo on the Go! is a Canadian TV series  created by Jeff Rosen and produced by Decode Entertainment  a DHX Media Company  in association with Decode Entertainment and Halifaxfilm. The TV series emphasizes the importance of movement for children through a plot element called """"Animoves""""  which are animations demonstrating specific body movements that viewers must learn in order to solve problems highlighted in each episode."",,,,,,,,,,,"
"tm24576,Naruto: Guardians of the Crescent Moon Kingdom,MOVIE,Naruto Uzumaki  Kakashi Hatake  Sakura Haruno  and Rock Lee are assigned to protect the prince of the Land of the Moon  Michiru  during his world trip,,,,,,,,,,,"
"ts74931,Kung Fu Panda Awesome Secrets,SHOW,In this pair of adventures  Po tells the story of how masters Thundering Rhino  Storming Ox and Croc met and takes on Shifu's biggest challenge yet.,2008,,0,['action'  'comedy'  'family'  'animation'],['US'],1.0,tt6963796,7.2,55.0,,"
"tm110923,Divine Intervention,MOVIE,Santa Claus tries to outrun a gang of knife-wielding youth. It's one of several vignettes of Palestinian life in Israel - in a neighborhood in Nazareth and at Al-Ram checkpoint in East Jerusalem. Most of the stories are droll  some absurd  one is mythic and fanciful,,,,,,,,,,,"
"tm75022,Zach Galifianakis: Live at the Purple Onion,MOVIE,From an inauspicious beginning performing comedy routines in the back of a burger joint in New York  unorthodox stand-up star Zach Galifianakis has made a splash on the scene with his inimitable brand of humor. In this live show filmed at San Francisco's Purple Onion nightclub  the versatile funnyman serves up a healthy dose of his signature wit.,2007,,61,['comedy'],['US'],,,,,6.223,7.0"
"ts98252,Dreamworks Happy Holidays from Madagascar,SHOW,Madagascar goes wild with holiday spirit in this set of Valentine's Day and Christmas-themed tales featuring everyone's favorite animal characters.,2005,TV-PG,0,['animation'  'comedy'  'family'],['US'],1.0,tt6929194,6.5,96.0,3.42,"
"ts20358,Half & Half,SHOW,Half & Half is an American sitcom that aired on UPN from September 23  2002  to May 15  2006. The show focuses on the lives of two paternal half-sisters in their twenties who were estranged throughout their childhood  and are finally developing a close relationship. The series is set in San Francisco.,,,,,,,,,,,"
"ts44053,The Qin Empire,SHOW,The Qin Empire is a 2009 Chinese television series based on Sun Haohui's novel of the same Chinese title. The 51 episodes long series chronicles the rise of the Qin state in the Warring States period during the reign of Duke Xiao of Qin. It was produced in 2006 and first aired on television channels in China in December 2009.,2009,TV-MA,46,['war'],['CN'],3.0,,,,74.088,8.7"
"ts63295,Vientos de agua,SHOW,Vientos de agua is a 2006 cult Argentine- Spanish mini TV series created by Juan José Campanella. The drama traces a Spaniard's emigration to Argentina in the 1930s  and  years later  his son's return to modern-day Spain.,,,,,,,,,,,"
"tm96037,Naruto Shippuden the Movie: The Lost Tower,MOVIE,""Assigned on a mission to capture Mukade  a missing-nin  Naruto Uzumaki sets out for the once glorious historic ruins of """"Ouran""""  where he pursues and corners the rouge ninja. Mukade's goal is revealed to be a dormant leyline within the ruins"",,,,,,,,,,,"
"tm418157,Monty Python Conquers America,MOVIE,This documentary follows the evolution of the British sketch comedy troupe that redefined humor and shaped an entire generation of American comics  focusing especially on their conquest of the American comedy scene ,2008,,55,['documentation'],[],,,,,1.922,6.5"
"ts1413,Autumn's Concerto,SHOW,Autumn's Concerto is a 2009 Taiwanese drama starring Ady An  Vanness Wu of F4  and Tiffany Hsu. It was produced by Sanlih E-Television and directed by Chen Hui Ling. The drama started filming in June 2009 and was completed in December 2009.,,,,,,,,,,,"
"ts98353,DreamWorks Spooky Stories,SHOW,A collection of animated tales includes shrek's thrilling tales and scared shrekless.,2009,TV-PG,26,['animation'],['US'],1.0,tt6958564,6.2,19.0,0.651,"
"ts137477,Behind Enemy Lines,SHOW,Documentary about the creation of the Commando's and their exploits in all areas of conflict,2001,TV-14,49,['drama'],['US'],1.0,tt5170230,7.2,42.0,,"
"ts4866,Fated to Love You,SHOW,Fated to Love You  also known as You're My Destiny  Sticky Note Girl or Destiny Love  is a 2008 Taiwanese drama starring Joe Chen  Ethan Juan  Baron Chen and Bianca Bai. It was produced by Sanlih E-Television and directed by Chen Ming Zhang with location filming in Taiwan  Hong Kong and Shanghai. It holds the record for the highest average single-episode rating at 10.91 with a peak at 13.64 for episode 20 broadcast on 27 July 2008  and broke the previous record held by The Prince Who Turns Into a Frog.,,,,,,,,,,,"
"ts34414,Nuevo Rico Nuevo Pobre,SHOW,Nuevo Rico Nuevo Pobre is a Colombian telenovela produced and broadcast by Caracol TV starring Martín Karpan  John Alex Toro  Maria Cecilia Botero  Carolina Acevedo  Hugo Gómez  former Miss Colombia Andrea Noceti and Andrés Toro.,,,,,,,,,,,"
"ts204466,Pecados capitales,SHOW,Evaristo Salinas is a successful businessman in his old age but knows he will die and decides to build a game between his family to see who is worthy of his inheritance. Each member of the Salinas family will be a cardinal sin.,2002,TV-MA,43,['comedy'  'drama'  'romance'],['CO'],1.0,tt0355119,8.5,190.0,2.625,"
"tm352863,Splatter,MOVIE,After self-righteous rockstar Johnny Splatter puts a bullet in his own head  only five people are chosen to attend the reading of his will: the manager  the shrink  the guitarist  the lover  and the groupie. Will they get what they came for  or what Splatter thinks they deserve?,2009,,29,['horror'],['US'],,tt6999072,,,2.047,3.4"
"ts67595,Pedro El Escamoso,SHOW,Pedro el escamoso is a popular telenovela filmed in Colombia and produced by the Colombian network  Caracol TV.,,,,,,,,,,,"
"tm84348,Doing Hard Time,MOVIE,A father's eight year old son is murdered in a gangland shooting. The father (Boris Kodjoe) gets himself thrown into prison to avenge his son's death.,2004,R,95,['crime'],['US'],,,,,6.132,5.4"
"tm41953,Tim Minchin: So F**king Rock Live,MOVIE,Comedic pianist Tim Minchin performs a host of his catchy songs that touch on everything from the Middle East to the healing power of canvas bags.,2008,,127,['comedy'],['GB'],,,,,2.761,6.9"
"tm421611,The Egyptian Nightingale,MOVIE,A poor guy want to be famous singer but he is a failure one when his mother dies he knows from her that he has a millionaire twins brother.,2008,,115,['comedy'],['EG'],,,,,2.176,7.1"
"ts178360,El cartel 2 - La guerra total,SHOW,Now Pepe Cadena finishes telling the story in which the most powerful drug traffickers in Colombia are strengthened but later fall while he and others dedicate themselves to the dangerous task of exposing them to collaborate with justice.,2010,TV-MA,44,['action'  'crime'  'horror'  'thriller'  'war'],['CO'],1.0,tt1667724,6.8,228.0,,"
"tm80487,Spookley the Square Pumpkin,MOVIE,""Dare to be square! In a world where """"The only good pumpkins are round pumpkins!"""" SPOOKLEY THE SQUARE PUMPKIN is often teased by the other pumpkins because of his odd shape. Soon  Spookley is befriended by Edgar  Allan and Poe  three hilarious spiders  who convince Spookley that square or not  he has a right to be the """"Pick of the Patch"""" on Halloween. """"A square pumpkin the Pick of the Patch?"""" Not if mean round pumpkins Big Tom and Little Tom can help it. These two bullies tease and taunt Spookley because of his square roots. Encouraged to continue to become the """"Pick of the Patch"""" by kindly Jack the Scarecrow and his bat sidekicks  Boris and Bella  Spookley isn't sure he has what it takes until a mighty storm threatens to destroy the entire patch. As the storm rolls the round pumpkins uncontrollably across the patch towards the raging river  Spookley realizes """"it's fine to be round while the weather is fair  but there are times it's better to be a square!"""""",2004,G,47,['family'  'animation'],['US'],,,,,3.355,4.6"
